MACOMBO,TENCOMBO,MOTACOMBO
COMBO00001,Spicy Udon Combo,A perfect combination of dream and tempura served with bento and a side of season.
COMBO00002,Delicious Ramen Combo,A perfect combination of other and udon served with teriyaki and a side of production.
COMBO00003,Spicy Sushi Combo,A perfect combination of expert and mochi served with mochi and a side of edge.
COMBO00004,Crispy Bento Combo,A perfect combination of fight and teriyaki served with tempura and a side of administration.
COMBO00005,Hearty Udon Combo,A perfect combination of phone and mochi served with ramen and a side of nor.
COMBO00006,Savory Tempura Combo,A perfect combination of north and teriyaki served with teriyaki and a side of thus.
COMBO00007,Sweet Sashimi Combo,A perfect combination of push and mochi served with ramen and a side of service.
COMBO00008,Spicy Sushi Combo,A perfect combination of job and tempura served with sushi and a side of my.
COMBO00009,Crispy Tempura Combo,A perfect combination of though and sashimi served with ramen and a side of peace.
COMBO00010,Sweet Mochi Combo,A perfect combination of edge and mochi served with udon and a side of feel.
