MACTMON,MAMENU,SOLUONG,GHICHU,DONGIATONG,MADONDATMON
CTMON04538,MENU000422,9,Itself identify street the program.,0,DONDAT0057
CTMON04539,MENU000569,7,History choose modern or catch treatment analysis.,0,DONDAT0579
CTMON04540,MENU000255,2,Daughter scene interest.,0,DONDAT1548
CTMON04541,MENU000140,3,Short policy detail kid environment college.,0,DONDAT2486
CTMON04542,MENU000068,1,Probably goal lay toward rock.,0,DONDAT0061
CTMON04543,MENU000410,1,Painting special such church important my music.,0,DONDAT2048
CTMON04544,MENU000208,3,Present under floor.,0,DONDAT2547
CTMON04545,MENU000592,9,Writer relate sell already.,0,DONDAT1394
CTMON04546,MENU000104,5,Dinner whom store.,0,DONDAT0376
CTMON04547,MENU000459,9,Rock whether purpose big already tend language.,0,DONDAT2934
CTMON04548,MENU000522,9,Way mention piece shoulder building certain program.,0,DONDAT1991
CTMON04549,MENU000407,2,Main foot character though support door.,0,DONDAT0944
CTMON04550,MENU000260,8,Site election tree civil.,0,DONDAT2484
CTMON04551,MENU000349,3,Carry American nearly financial suddenly.,0,DONDAT1327
CTMON04552,MENU000265,3,Sit two land arm.,0,DONDAT0906
CTMON04553,MENU000354,10,Reason peace rest range officer kitchen.,0,DONDAT2094
CTMON04554,MENU000372,5,Character plant way wear argue.,0,DONDAT0339
CTMON04555,MENU000288,1,Voice civil source admit actually smile think anything.,0,DONDAT0609
CTMON04556,MENU000576,1,Some employee moment thing south official.,0,DONDAT0650
CTMON04557,MENU000360,5,Mission serve behavior administration thousand animal statement.,0,DONDAT2862
CTMON04558,MENU000338,2,Inside let building gas too chair feel new.,0,DONDAT0474
CTMON04559,MENU000468,3,Mention reveal couple claim animal page.,0,DONDAT0255
CTMON04560,MENU000159,3,Catch pull citizen begin top.,0,DONDAT1690
CTMON04561,MENU000357,9,Until newspaper then popular leave important hit.,0,DONDAT2305
CTMON04562,MENU000084,4,Others so attack left.,0,DONDAT0622
CTMON04563,MENU000243,1,Perhaps yourself minute simple so off think physical.,0,DONDAT2109
CTMON04564,MENU000256,8,Lead near station star structure dinner no.,0,DONDAT2656
CTMON04565,MENU000587,7,Anyone catch upon improve cover southern.,0,DONDAT0237
CTMON04566,MENU000175,9,Until stop late.,0,DONDAT2736
CTMON04567,MENU000203,10,Cause value himself car may think detail.,0,DONDAT0241
CTMON04568,MENU000543,7,Industry listen music before peace ok cause.,0,DONDAT1369
CTMON04569,MENU000055,3,Include glass debate simply.,0,DONDAT0322
CTMON04570,MENU000426,4,Bad debate month rule.,0,DONDAT0283
CTMON04571,MENU000264,2,Ever election deal.,0,DONDAT0415
CTMON04572,MENU000283,4,President only see some remain into mean.,0,DONDAT1544
CTMON04573,MENU000498,8,Congress heart role up.,0,DONDAT1883
CTMON04574,MENU000560,8,Matter stuff during fire alone.,0,DONDAT2241
CTMON04575,MENU000357,8,Decision story hand bad.,0,DONDAT0340
CTMON04576,MENU000361,9,Direction past tax charge ten.,0,DONDAT1426
CTMON04577,MENU000122,4,Property little current.,0,DONDAT0216
CTMON04578,MENU000197,2,Adult himself range spring.,0,DONDAT2194
CTMON04579,MENU000533,9,War must follow tough go.,0,DONDAT1318
CTMON04580,MENU000339,5,Act son both audience.,0,DONDAT2750
CTMON04581,MENU000436,8,Practice light despite win.,0,DONDAT2667
CTMON04582,MENU000537,9,Many hope his measure crime.,0,DONDAT0083
CTMON04583,MENU000314,1,Body hold likely assume.,0,DONDAT1333
CTMON04584,MENU000027,5,Bring power model think around next.,0,DONDAT0095
CTMON04585,MENU000215,10,Meeting themselves trouble.,0,DONDAT2740
CTMON04586,MENU000239,1,Just film once fall lose talk.,0,DONDAT1843
CTMON04587,MENU000326,7,Southern clear decide.,0,DONDAT1570
CTMON04588,MENU000298,1,Dinner gun heart late.,0,DONDAT0143
CTMON04589,MENU000407,2,City read break provide.,0,DONDAT1572
CTMON04590,MENU000201,5,Cultural happy major reason pick could.,0,DONDAT0949
CTMON04591,MENU000515,5,Relationship million knowledge executive.,0,DONDAT2562
CTMON04592,MENU000288,6,Indeed boy property size fact.,0,DONDAT2722
CTMON04593,MENU000146,7,Production send able someone.,0,DONDAT0013
CTMON04594,MENU000157,5,Bad cut past suffer page two popular.,0,DONDAT0655
CTMON04595,MENU000210,6,Each start campaign police.,0,DONDAT2275
CTMON04596,MENU000485,2,Employee seat network position.,0,DONDAT0885
CTMON04597,MENU000022,2,Staff weight boy international.,0,DONDAT2732
CTMON04598,MENU000139,6,Peace responsibility enough sit hospital south we.,0,DONDAT0247
CTMON04599,MENU000474,9,Certainly establish why father us certain.,0,DONDAT1355
CTMON04600,MENU000162,4,Skin keep describe get range.,0,DONDAT0101
CTMON04601,MENU000370,6,Condition expect might career west.,0,DONDAT2845
CTMON04602,MENU000127,7,When between senior cut raise.,0,DONDAT2400
CTMON04603,MENU000514,9,Director new fill.,0,DONDAT2409
CTMON04604,MENU000506,1,Attention gas nation language like.,0,DONDAT1456
CTMON04605,MENU000505,5,Group because involve condition read offer because.,0,DONDAT1957
CTMON04606,MENU000317,8,Today example outside and onto try for push.,0,DONDAT1685
CTMON04607,MENU000189,6,Establish drive spring allow ok describe.,0,DONDAT2920
CTMON04608,MENU000298,2,Around grow during case ask performance popular.,0,DONDAT1180
CTMON04609,MENU000541,3,Human wrong class no speak.,0,DONDAT2980
CTMON04610,MENU000551,1,If notice sign property security continue.,0,DONDAT0241
CTMON04611,MENU000225,1,Man main where detail ahead attack activity focus.,0,DONDAT2206
CTMON04612,MENU000575,8,Low behind three art.,0,DONDAT0064
CTMON04613,MENU000517,3,Arm admit light center side condition.,0,DONDAT1924
CTMON04614,MENU000322,5,Meeting senior conference force pick.,0,DONDAT2446
CTMON04615,MENU000440,6,Truth middle education address.,0,DONDAT2271
CTMON04616,MENU000433,7,Pass though enter candidate college recognize admit.,0,DONDAT1587
CTMON04617,MENU000031,10,Which cup loss economy couple president.,0,DONDAT1801
CTMON04618,MENU000463,8,Family home strong nearly realize agent loss.,0,DONDAT1402
CTMON04619,MENU000093,7,Or professor thus character.,0,DONDAT1676
CTMON04620,MENU000129,5,Something small win when pretty news decide.,0,DONDAT0803
CTMON04621,MENU000191,5,Decide whatever popular believe play.,0,DONDAT1706
CTMON04622,MENU000224,8,Former star rise art probably think.,0,DONDAT1606
CTMON04623,MENU000489,3,Establish whole wonder treat letter natural military.,0,DONDAT0477
CTMON04624,MENU000258,4,Exist seek north deep.,0,DONDAT0113
CTMON04625,MENU000300,6,Family southern learn behavior.,0,DONDAT2977
CTMON04626,MENU000414,9,Again measure place time grow state.,0,DONDAT0658
CTMON04627,MENU000441,7,Threat and whose large rest politics ground.,0,DONDAT0387
CTMON04628,MENU000295,5,Wife writer know report increase.,0,DONDAT0252
CTMON04629,MENU000001,2,Painting knowledge technology debate dream.,0,DONDAT0763
CTMON04630,MENU000226,10,Rich trip college film collection.,0,DONDAT0697
CTMON04631,MENU000547,7,Word young letter research listen despite late.,0,DONDAT2448
CTMON04632,MENU000295,4,Will final market behavior.,0,DONDAT1058
CTMON04633,MENU000235,10,Attorney little painting time power police travel.,0,DONDAT1289
CTMON04634,MENU000550,7,Yeah decision build mission become future minute.,0,DONDAT0015
CTMON04635,MENU000417,10,Throw thing suggest will order example.,0,DONDAT1884
CTMON04636,MENU000200,2,Staff still mind fine bag.,0,DONDAT2828
CTMON04637,MENU000236,1,Price save treat development.,0,DONDAT2724
CTMON04638,MENU000253,2,Through black per rate himself.,0,DONDAT2222
CTMON04639,MENU000190,7,Kitchen guy lot always why inside occur girl.,0,DONDAT0439
CTMON04640,MENU000082,1,Whole card build simple authority issue surface.,0,DONDAT0913
CTMON04641,MENU000025,1,Partner administration us source.,0,DONDAT0370
CTMON04642,MENU000496,10,Candidate late huge wait member name war.,0,DONDAT1845
CTMON04643,MENU000437,5,Blood resource politics great.,0,DONDAT1386
CTMON04644,MENU000111,9,Safe then when that discover adult thus.,0,DONDAT1812
CTMON04645,MENU000542,9,Understand down work story concern dark.,0,DONDAT0400
CTMON04646,MENU000570,4,Break prove answer report job trip.,0,DONDAT2079
CTMON04647,MENU000539,5,Worker sort that sort candidate enjoy.,0,DONDAT2950
CTMON04648,MENU000492,10,Parent player baby seek.,0,DONDAT1673
CTMON04649,MENU000361,9,Hotel yet employee would fire type.,0,DONDAT0324
CTMON04650,MENU000416,10,Worker dog sort grow young.,0,DONDAT0747
CTMON04651,MENU000578,9,Get both necessary set record specific personal fish.,0,DONDAT2829
CTMON04652,MENU000575,6,Six free number under office.,0,DONDAT1982
CTMON04653,MENU000044,8,Me so attorney above.,0,DONDAT1961
CTMON04654,MENU000159,2,Production realize body course contain letter.,0,DONDAT0306
CTMON04655,MENU000167,7,Response believe audience exist check line three.,0,DONDAT2239
CTMON04656,MENU000130,10,Budget all own situation stage amount stuff.,0,DONDAT0056
CTMON04657,MENU000213,2,Sell particularly city kind place technology his.,0,DONDAT2056
CTMON04658,MENU000086,2,Down late upon poor report.,0,DONDAT0513
CTMON04659,MENU000366,10,Question record far everyone ground inside system.,0,DONDAT2201
CTMON04660,MENU000450,8,Either nice carry next indicate window Mr usually.,0,DONDAT0882
CTMON04661,MENU000217,9,Security late possible.,0,DONDAT0516
CTMON04662,MENU000114,9,Hit participant matter we.,0,DONDAT0949
CTMON04663,MENU000370,8,Suffer ok story.,0,DONDAT0081
CTMON04664,MENU000065,8,Education huge thus travel top.,0,DONDAT1958
CTMON04665,MENU000371,8,Executive you room control conference action play few.,0,DONDAT0565
CTMON04666,MENU000458,10,Other charge stock media compare daughter.,0,DONDAT2491
CTMON04667,MENU000519,5,Admit cultural take then here memory.,0,DONDAT1622
CTMON04668,MENU000219,10,Source music term.,0,DONDAT2135
CTMON04669,MENU000307,1,Trip southern blood decade often tough spring.,0,DONDAT0818
CTMON04670,MENU000518,5,By first southern rise somebody among.,0,DONDAT0450
CTMON04671,MENU000307,4,Man list listen expert.,0,DONDAT0254
CTMON04672,MENU000122,10,Should born including can the field team.,0,DONDAT0462
CTMON04673,MENU000049,7,Alone painting material area bag capital join.,0,DONDAT2100
CTMON04674,MENU000565,5,Interest century fill likely child.,0,DONDAT0468
CTMON04675,MENU000170,5,Rule majority book sing.,0,DONDAT2817
CTMON04676,MENU000116,6,Theory capital fight dream.,0,DONDAT2181
CTMON04677,MENU000170,10,More drop any think.,0,DONDAT0652
CTMON04678,MENU000573,6,School but deep cultural.,0,DONDAT2772
CTMON04679,MENU000469,4,Development summer enough according special.,0,DONDAT2467
CTMON04680,MENU000251,2,Trip election what instead.,0,DONDAT2602
CTMON04681,MENU000516,2,Manage position us task man available others.,0,DONDAT2714
CTMON04682,MENU000077,5,Political accept clear little discuss focus.,0,DONDAT1547
CTMON04683,MENU000013,2,Young leg state after role act.,0,DONDAT0301
CTMON04684,MENU000498,10,Whether drop stock.,0,DONDAT0505
CTMON04685,MENU000300,2,Price door toward blue price pressure.,0,DONDAT2656
CTMON04686,MENU000019,3,Account lawyer agency family.,0,DONDAT2817
CTMON04687,MENU000233,2,Remember with hospital while social what each.,0,DONDAT1495
CTMON04688,MENU000044,7,Father treatment name available game.,0,DONDAT0878
CTMON04689,MENU000180,5,Company according rise water time will ball.,0,DONDAT0163
CTMON04690,MENU000197,4,Say per thing religious beyond democratic anything process.,0,DONDAT0500
CTMON04691,MENU000003,6,Perhaps unit coach maintain.,0,DONDAT1410
CTMON04692,MENU000225,6,Seek thing improve health social seek.,0,DONDAT1069
CTMON04693,MENU000326,5,Number allow especially group.,0,DONDAT0591
CTMON04694,MENU000421,5,Owner draw two present information traditional someone.,0,DONDAT2724
CTMON04695,MENU000153,6,Represent some cold strong point service.,0,DONDAT0106
CTMON04696,MENU000127,9,Hit look kind read.,0,DONDAT0384
CTMON04697,MENU000111,5,Whole wear play take prevent industry.,0,DONDAT1586
CTMON04698,MENU000061,4,Step perform policy.,0,DONDAT2139
CTMON04699,MENU000432,7,During environment or economy space.,0,DONDAT2629
CTMON04700,MENU000264,4,Adult out memory.,0,DONDAT1494
CTMON04701,MENU000218,5,Set field language daughter.,0,DONDAT1754
CTMON04702,MENU000135,5,Energy able cup million.,0,DONDAT0553
CTMON04703,MENU000289,4,Mouth culture energy.,0,DONDAT1657
CTMON04704,MENU000519,9,Name wear stop first situation measure.,0,DONDAT1395
CTMON04705,MENU000262,6,Exist manage central couple worry plant fish.,0,DONDAT2514
CTMON04706,MENU000368,9,Among woman region rather stage almost program production.,0,DONDAT1587
CTMON04707,MENU000358,2,Positive community dog discuss wonder.,0,DONDAT1449
CTMON04708,MENU000587,8,Form behind right make entire happen most.,0,DONDAT2275
CTMON04709,MENU000571,9,International suggest where dog require deep.,0,DONDAT1605
CTMON04710,MENU000500,9,Wide official whole evening also.,0,DONDAT1965
CTMON04711,MENU000406,2,Yet money record will threat week body.,0,DONDAT0279
CTMON04712,MENU000525,6,Candidate generation either mission.,0,DONDAT2792
CTMON04713,MENU000152,8,System type really edge tonight what law.,0,DONDAT1119
CTMON04714,MENU000075,5,Attorney ok stop know become.,0,DONDAT1167
CTMON04715,MENU000098,5,Ok in group into food name build each.,0,DONDAT1949
CTMON04716,MENU000036,10,People oil product care.,0,DONDAT2657
CTMON04717,MENU000192,8,Whose church you even event.,0,DONDAT1999
CTMON04718,MENU000231,7,Source contain magazine free people.,0,DONDAT1374
CTMON04719,MENU000434,1,Draw customer before manager.,0,DONDAT1754
CTMON04720,MENU000062,6,Name course tree explain model over water.,0,DONDAT0457
CTMON04721,MENU000496,9,House financial read agent small ask.,0,DONDAT2428
CTMON04722,MENU000072,1,Relationship article recent left including.,0,DONDAT1607
CTMON04723,MENU000337,7,Wrong money movement role box weight.,0,DONDAT2706
CTMON04724,MENU000027,8,A money officer special art understand himself.,0,DONDAT0908
CTMON04725,MENU000461,8,Store magazine family that throughout.,0,DONDAT1002
CTMON04726,MENU000515,3,Art example seat range oil avoid become.,0,DONDAT1850
CTMON04727,MENU000282,1,Others light hit information class without.,0,DONDAT2287
CTMON04728,MENU000188,10,Phone cause real across.,0,DONDAT0836
CTMON04729,MENU000287,6,Political paper compare care Republican cut fall.,0,DONDAT2243
CTMON04730,MENU000223,6,Clear hair computer something.,0,DONDAT0661
CTMON04731,MENU000182,8,City thought artist imagine.,0,DONDAT0322
CTMON04732,MENU000141,7,Describe whom every head American.,0,DONDAT2676
CTMON04733,MENU000427,7,Along think southern place notice.,0,DONDAT2722
CTMON04734,MENU000326,4,House range once measure green region town box.,0,DONDAT0966
CTMON04735,MENU000405,3,Office newspaper standard computer property citizen special.,0,DONDAT1952
CTMON04736,MENU000332,7,Information walk still page call without so business.,0,DONDAT1655
CTMON04737,MENU000452,5,Fall little wife major contain traditional stuff.,0,DONDAT2390
CTMON04738,MENU000591,1,Born new collection.,0,DONDAT2430
CTMON04739,MENU000589,5,Subject store information hard room debate site.,0,DONDAT1766
CTMON04740,MENU000168,4,Red federal account its.,0,DONDAT2452
CTMON04741,MENU000236,5,Not student everyone song job ok.,0,DONDAT2745
CTMON04742,MENU000415,10,Start almost walk level finally adult.,0,DONDAT1595
CTMON04743,MENU000194,6,Moment production north size.,0,DONDAT2572
CTMON04744,MENU000266,3,Black particularly play religious gun fear though impact.,0,DONDAT2173
CTMON04745,MENU000599,5,Region the high sound have.,0,DONDAT1713
CTMON04746,MENU000541,2,Mean none get million gas analysis say sister.,0,DONDAT2603
CTMON04747,MENU000556,1,Performance oil stop argue.,0,DONDAT0513
CTMON04748,MENU000264,9,National perhaps travel box town fast any.,0,DONDAT1330
CTMON04749,MENU000574,2,Play condition staff one institution official party.,0,DONDAT0564
CTMON04750,MENU000394,4,Make local along top energy push least.,0,DONDAT2914
CTMON04751,MENU000255,5,Speak campaign itself get.,0,DONDAT2241
CTMON04752,MENU000442,5,Change subject later example term sometimes leader.,0,DONDAT2271
CTMON04753,MENU000144,3,Occur mention fire.,0,DONDAT0047
CTMON04754,MENU000046,3,Lay pattern treat yeah wait cut discussion religious.,0,DONDAT0902
CTMON04755,MENU000265,10,Game less large blood usually where bring.,0,DONDAT1326
CTMON04756,MENU000463,5,Back computer peace citizen fine bank.,0,DONDAT2269
CTMON04757,MENU000251,9,Fly wrong again.,0,DONDAT1065
CTMON04758,MENU000053,10,Nearly course Democrat today but.,0,DONDAT0336
CTMON04759,MENU000140,10,Yourself while property close change professional use.,0,DONDAT2430
CTMON04760,MENU000327,2,She unit program we federal leave.,0,DONDAT2650
CTMON04761,MENU000324,1,Nothing lose song ok federal above century open.,0,DONDAT0950
CTMON04762,MENU000594,6,Necessary daughter career.,0,DONDAT1718
CTMON04763,MENU000517,1,Lead how that new.,0,DONDAT1590
CTMON04764,MENU000550,3,Explain television itself network throw note recent player.,0,DONDAT2428
CTMON04765,MENU000160,8,Girl establish real mother.,0,DONDAT0805
CTMON04766,MENU000153,8,Over Congress indeed show black project people decision.,0,DONDAT1916
CTMON04767,MENU000172,5,Couple away throughout candidate company friend.,0,DONDAT0427
CTMON04768,MENU000037,9,Open threat white ability data myself then more.,0,DONDAT0519
CTMON04769,MENU000324,1,Recognize defense former church employee citizen.,0,DONDAT1155
CTMON04770,MENU000020,4,Tell wide yard state we.,0,DONDAT2600
CTMON04771,MENU000375,9,Animal million need remember state.,0,DONDAT2144
CTMON04772,MENU000469,6,Idea thousand would side well.,0,DONDAT2509
CTMON04773,MENU000433,1,Option significant media per.,0,DONDAT2630
CTMON04774,MENU000034,6,Recent particular there above story.,0,DONDAT0268
CTMON04775,MENU000159,9,Job onto speak still state federal.,0,DONDAT0025
CTMON04776,MENU000183,7,Never operation far couple prove girl.,0,DONDAT1429
CTMON04777,MENU000533,10,Indicate truth meet example answer.,0,DONDAT0295
CTMON04778,MENU000266,8,Worker value budget drive happy shoulder eye.,0,DONDAT0181
CTMON04779,MENU000244,9,Well national car local great cover.,0,DONDAT2865
CTMON04780,MENU000491,9,Even different up partner leave still.,0,DONDAT0421
CTMON04781,MENU000227,3,Protect way development method.,0,DONDAT1557
CTMON04782,MENU000127,5,Place either imagine power large.,0,DONDAT0694
CTMON04783,MENU000481,2,Total box beautiful song develop street.,0,DONDAT0314
CTMON04784,MENU000001,9,See she radio father future night.,0,DONDAT2022
CTMON04785,MENU000246,9,Girl throw result which.,0,DONDAT1795
CTMON04786,MENU000171,9,System court model would hold guess.,0,DONDAT0957
CTMON04787,MENU000108,7,Theory politics rise lawyer.,0,DONDAT2616
CTMON04788,MENU000060,4,See low candidate wish collection store control.,0,DONDAT0777
CTMON04789,MENU000299,7,Health none area top southern behind little.,0,DONDAT0853
CTMON04790,MENU000559,3,Wall single pay security office treatment.,0,DONDAT0120
CTMON04791,MENU000118,9,Bag individual bar down establish heavy.,0,DONDAT2376
CTMON04792,MENU000124,3,Human recently quite behavior sell represent spring.,0,DONDAT0228
CTMON04793,MENU000376,9,Different expert when.,0,DONDAT1080
CTMON04794,MENU000529,1,Weight civil religious democratic policy.,0,DONDAT2956
CTMON04795,MENU000582,7,Take pretty reduce law.,0,DONDAT1836
CTMON04796,MENU000123,3,Company war forward show half future.,0,DONDAT0355
CTMON04797,MENU000300,2,Scene defense almost both night stay bank way.,0,DONDAT0151
CTMON04798,MENU000494,4,Word positive your morning either.,0,DONDAT2068
CTMON04799,MENU000592,7,Citizen when later save occur consumer.,0,DONDAT2394
CTMON04800,MENU000334,8,Speech song firm smile left still this level.,0,DONDAT2333
CTMON04801,MENU000066,2,Beat least they region true decision.,0,DONDAT1304
CTMON04802,MENU000536,6,Wait ready decade financial.,0,DONDAT2667
CTMON04803,MENU000598,7,Maybe bring report within expect over.,0,DONDAT2568
CTMON04804,MENU000261,4,Red something up natural bag street.,0,DONDAT2352
CTMON04805,MENU000061,7,Our purpose recent present cell tend service.,0,DONDAT1708
CTMON04806,MENU000444,6,Dinner party point get.,0,DONDAT2561
CTMON04807,MENU000198,5,Sister daughter exactly site.,0,DONDAT2840
CTMON04808,MENU000452,3,Buy such debate people.,0,DONDAT1378
CTMON04809,MENU000557,7,Difference third vote.,0,DONDAT1816
CTMON04810,MENU000453,8,Doctor teach something idea know herself.,0,DONDAT2874
CTMON04811,MENU000489,2,Thing star development money safe world mind.,0,DONDAT0003
CTMON04812,MENU000177,2,Point side detail here mention head.,0,DONDAT0267
CTMON04813,MENU000567,6,Show pass like foreign.,0,DONDAT2022
CTMON04814,MENU000047,5,Push enough everyone ability growth race.,0,DONDAT0954
CTMON04815,MENU000415,9,Poor television population social instead none.,0,DONDAT1966
CTMON04816,MENU000391,6,Total drop yes career.,0,DONDAT2369
CTMON04817,MENU000151,1,City certainly piece while career.,0,DONDAT2463
CTMON04818,MENU000017,2,Religious throughout us through.,0,DONDAT2887
CTMON04819,MENU000248,9,North budget travel produce.,0,DONDAT2126
CTMON04820,MENU000320,4,Bar you current deal summer cover tell.,0,DONDAT1797
CTMON04821,MENU000462,10,Real trial perhaps identify together piece writer.,0,DONDAT2262
CTMON04822,MENU000225,4,Seem program ready carry Mr money idea.,0,DONDAT2208
CTMON04823,MENU000021,8,Community base believe management fire actually.,0,DONDAT0831
CTMON04824,MENU000119,2,Low hospital maybe keep form their.,0,DONDAT1540
CTMON04825,MENU000311,8,Whom small poor tonight good how entire.,0,DONDAT1946
CTMON04826,MENU000349,9,Pass join wind can.,0,DONDAT2750
CTMON04827,MENU000280,5,Significant scene charge break.,0,DONDAT1503
CTMON04828,MENU000510,7,Garden have themselves cold research improve.,0,DONDAT2393
CTMON04829,MENU000425,4,View nature we individual front soldier.,0,DONDAT1378
CTMON04830,MENU000440,2,Stuff nice note source apply.,0,DONDAT1236
CTMON04831,MENU000570,4,Customer head their white yourself attorney.,0,DONDAT1063
CTMON04832,MENU000156,9,Article simply radio decade can.,0,DONDAT2040
CTMON04833,MENU000567,5,Through heart window style edge left.,0,DONDAT1146
CTMON04834,MENU000516,4,Leave image consumer director night.,0,DONDAT0707
CTMON04835,MENU000315,9,For accept election particular center along.,0,DONDAT1902
CTMON04836,MENU000230,7,Pressure also play truth anyone.,0,DONDAT2661
CTMON04837,MENU000382,9,Page early whatever candidate leader full.,0,DONDAT1746
CTMON04838,MENU000256,10,Training worry late attention until assume think.,0,DONDAT1087
CTMON04839,MENU000353,1,Need particular themselves sister.,0,DONDAT1416
CTMON04840,MENU000220,5,Candidate thing by.,0,DONDAT1698
CTMON04841,MENU000258,5,Project end land around he.,0,DONDAT2666
CTMON04842,MENU000197,8,Need recognize thank food box.,0,DONDAT1073
CTMON04843,MENU000513,9,Check product enter old century challenge trip.,0,DONDAT1634
CTMON04844,MENU000321,1,Character would half develop work will.,0,DONDAT1024
CTMON04845,MENU000102,7,Option major finally.,0,DONDAT1475
CTMON04846,MENU000479,6,Mention despite form but.,0,DONDAT2709
CTMON04847,MENU000257,6,Political interest water listen begin home necessary.,0,DONDAT0946
CTMON04848,MENU000414,9,Fact particularly wish majority their.,0,DONDAT1365
CTMON04849,MENU000540,4,Probably growth official.,0,DONDAT0004
CTMON04850,MENU000160,8,Significant study law author gun.,0,DONDAT1477
CTMON04851,MENU000389,3,Career morning page address central around together.,0,DONDAT1435
CTMON04852,MENU000122,5,Officer others chair fire per.,0,DONDAT2496
CTMON04853,MENU000566,10,You nearly financial subject few rest.,0,DONDAT1290
CTMON04854,MENU000385,10,Purpose through somebody next.,0,DONDAT2043
CTMON04855,MENU000488,4,Expect red check street into whom.,0,DONDAT1455
CTMON04856,MENU000243,4,Once still buy language way service.,0,DONDAT0802
CTMON04857,MENU000184,6,Lead gas remember up if term.,0,DONDAT1818
CTMON04858,MENU000511,4,Carry pass cell out consumer.,0,DONDAT2457
CTMON04859,MENU000285,4,Page gas hotel suggest tend.,0,DONDAT2905
CTMON04860,MENU000402,3,Bring budget deep share account shoulder.,0,DONDAT2882
CTMON04861,MENU000093,7,Figure dream according group.,0,DONDAT2747
CTMON04862,MENU000468,9,Provide reality whether thousand catch have bed.,0,DONDAT2490
CTMON04863,MENU000099,3,Mean section knowledge.,0,DONDAT0982
CTMON04864,MENU000072,6,Gas plan activity foot past force.,0,DONDAT0393
CTMON04865,MENU000468,7,Sing base political describe piece.,0,DONDAT1825
CTMON04866,MENU000249,4,Hit notice where drug front woman.,0,DONDAT0306
CTMON04867,MENU000403,10,Phone door these until million expect science.,0,DONDAT1998
CTMON04868,MENU000379,9,Situation author move never.,0,DONDAT2001
CTMON04869,MENU000082,10,Like some nor example family then.,0,DONDAT2407
CTMON04870,MENU000072,8,Attention daughter simple threat face pattern.,0,DONDAT2711
CTMON04871,MENU000536,9,Small we full.,0,DONDAT2847
CTMON04872,MENU000009,7,Vote deep common child throw book.,0,DONDAT2347
CTMON04873,MENU000114,2,Back play office open international project nice.,0,DONDAT0621
CTMON04874,MENU000344,7,Skin through easy operation sort join.,0,DONDAT0373
CTMON04875,MENU000502,7,Consider same difficult however buy couple.,0,DONDAT0012
CTMON04876,MENU000489,5,Behavior national piece toward chair former notice commercial.,0,DONDAT0289
CTMON04877,MENU000584,5,Though relationship simply maybe prove well.,0,DONDAT2429
CTMON04878,MENU000530,7,Whom station guy century authority skin actually treatment.,0,DONDAT1216
CTMON04879,MENU000355,4,Clearly beat important lawyer behind.,0,DONDAT0145
CTMON04880,MENU000414,6,Method program north tree fine grow least part.,0,DONDAT1972
CTMON04881,MENU000570,1,Avoid nice age tell above teacher.,0,DONDAT2185
CTMON04882,MENU000329,6,Watch matter movement former deal.,0,DONDAT0253
CTMON04883,MENU000325,5,Weight spend collection popular worry accept.,0,DONDAT2141
CTMON04884,MENU000169,3,Avoid less out father full.,0,DONDAT2405
CTMON04885,MENU000569,7,Hotel myself happen throughout compare.,0,DONDAT2763
CTMON04886,MENU000450,6,Exist show clearly bank sound within daughter member.,0,DONDAT0648
