MACTMON,MAMENU,SOLUONG,GHICHU,DONGIATONG,MADONDATMON
CTMON01403,MENU000127,10,Age education prevent affect factor.,0,DONDAT2745
CTMON01404,MENU000571,6,Compare bill charge together.,0,DONDAT1382
CTMON01405,MENU000056,7,Summer name project put country deep.,0,DONDAT2701
CTMON01406,MENU000306,6,If between increase dark.,0,DONDAT2992
CTMON01407,MENU000325,2,Professor key far.,0,DONDAT2342
CTMON01408,MENU000387,3,Throughout point western.,0,DONDAT1530
CTMON01409,MENU000526,4,Total particular child few raise.,0,DONDAT1626
CTMON01410,MENU000595,9,Soon seven pretty tree part son.,0,DONDAT2893
CTMON01411,MENU000113,7,Specific heavy wide main wrong style care from.,0,DONDAT1920
CTMON01412,MENU000423,10,End amount example gas friend but those level.,0,DONDAT1084
CTMON01413,MENU000151,5,Tv education record similar today drug.,0,DONDAT0111
CTMON01414,MENU000401,7,Yeah trial under movement official.,0,DONDAT0947
CTMON01415,MENU000019,10,Without set over administration cup yeah leg east.,0,DONDAT1727
CTMON01416,MENU000393,5,True far hotel mean whole recent.,0,DONDAT2956
CTMON01417,MENU000064,8,Oil whose administration start recently life nothing hot.,0,DONDAT1794
CTMON01418,MENU000384,5,There structure people light record.,0,DONDAT0111
CTMON01419,MENU000198,10,None economic apply country part someone new.,0,DONDAT0136
CTMON01420,MENU000101,6,Card window ten arm.,0,DONDAT0618
CTMON01421,MENU000525,4,College mouth true evidence give ground.,0,DONDAT0515
CTMON01422,MENU000538,2,Film event check.,0,DONDAT2407
CTMON01423,MENU000099,8,Change back resource listen see Congress.,0,DONDAT1778
CTMON01424,MENU000143,5,Let woman course establish so high bad.,0,DONDAT2069
CTMON01425,MENU000537,10,Appear effect capital television conference suggest.,0,DONDAT1329
CTMON01426,MENU000028,4,Movement already wrong employee open top white.,0,DONDAT2780
CTMON01427,MENU000103,6,Cause especially yeah movie specific rest spring.,0,DONDAT2728
CTMON01428,MENU000441,9,Another offer factor through man any.,0,DONDAT0451
CTMON01429,MENU000189,8,Serve ground shake wife knowledge.,0,DONDAT2546
CTMON01430,MENU000345,7,Commercial letter suddenly similar policy before from.,0,DONDAT1286
CTMON01431,MENU000564,2,Result wear sound response.,0,DONDAT1917
CTMON01432,MENU000197,8,Term rest remember often involve after then.,0,DONDAT2865
CTMON01433,MENU000284,4,Company relate professor accept.,0,DONDAT2988
CTMON01434,MENU000454,3,Picture bill four but tough.,0,DONDAT1926
CTMON01435,MENU000442,3,Line inside speech land mouth.,0,DONDAT0581
CTMON01436,MENU000349,10,She record cold job process tonight.,0,DONDAT0922
CTMON01437,MENU000010,7,Usually might great run piece put.,0,DONDAT0160
CTMON01438,MENU000359,2,Specific successful week style best.,0,DONDAT0942
CTMON01439,MENU000053,5,Class little heart make kid.,0,DONDAT1385
CTMON01440,MENU000371,4,Upon power great follow task although meet.,0,DONDAT2664
CTMON01441,MENU000493,7,Economy fire bring image major maybe.,0,DONDAT1198
CTMON01442,MENU000061,3,You play decide south break.,0,DONDAT2836
CTMON01443,MENU000540,6,Religious manager interview name degree listen.,0,DONDAT1752
CTMON01444,MENU000232,7,Tax federal camera.,0,DONDAT0935
CTMON01445,MENU000573,6,Interest opportunity agency well today film somebody.,0,DONDAT1823
CTMON01446,MENU000107,9,Outside people couple over agency forward Republican.,0,DONDAT2672
CTMON01447,MENU000282,2,Walk admit chance analysis toward.,0,DONDAT2357
CTMON01448,MENU000229,6,Support author away concern strategy determine cup.,0,DONDAT1239
CTMON01449,MENU000266,7,Old today increase couple where account reality.,0,DONDAT2865
CTMON01450,MENU000466,8,Performance follow animal theory finish large look.,0,DONDAT0056
CTMON01451,MENU000478,7,Team grow tree listen then trial.,0,DONDAT2388
CTMON01452,MENU000566,10,Help far do image at do.,0,DONDAT0764
CTMON01453,MENU000243,4,Continue professional claim budget certainly service whose feeling.,0,DONDAT2707
CTMON01454,MENU000499,8,Field force finally carry lose dream seem.,0,DONDAT0687
CTMON01455,MENU000086,2,Dream small sea.,0,DONDAT1975
CTMON01456,MENU000111,8,Too also born son camera cup nation could.,0,DONDAT1376
CTMON01457,MENU000286,10,Main part reflect among weight citizen imagine.,0,DONDAT1948
CTMON01458,MENU000108,2,Far story wall what difficult operation.,0,DONDAT1003
CTMON01459,MENU000590,9,Use term somebody political.,0,DONDAT0217
CTMON01460,MENU000011,2,Wife per write decision summer family teach.,0,DONDAT1024
CTMON01461,MENU000086,1,Most real seven.,0,DONDAT1555
CTMON01462,MENU000014,5,Better big sure one west tell.,0,DONDAT2530
CTMON01463,MENU000158,4,Morning can cultural no whom.,0,DONDAT2522
CTMON01464,MENU000154,6,Alone minute several million mother.,0,DONDAT2587
CTMON01465,MENU000020,9,Perform firm leg entire special billion.,0,DONDAT2363
CTMON01466,MENU000165,7,Respond eight letter somebody.,0,DONDAT0136
CTMON01467,MENU000191,10,Quite inside economic deal military need.,0,DONDAT0687
CTMON01468,MENU000547,10,Born page poor wife notice.,0,DONDAT0742
CTMON01469,MENU000116,7,Population least institution kitchen.,0,DONDAT0859
CTMON01470,MENU000579,3,Seem ok must lot put reduce nation.,0,DONDAT1342
CTMON01471,MENU000083,10,Become through traditional exist.,0,DONDAT0446
CTMON01472,MENU000303,7,Everything understand eat fight.,0,DONDAT2003
CTMON01473,MENU000328,7,News tough work child concern.,0,DONDAT2148
CTMON01474,MENU000297,7,All some amount win policy what house.,0,DONDAT2329
CTMON01475,MENU000350,8,Determine dream billion message action worker baby.,0,DONDAT1637
CTMON01476,MENU000543,4,Quite hand law stuff need drop star rest.,0,DONDAT1366
CTMON01477,MENU000411,7,Sometimes statement blue law culture.,0,DONDAT0291
CTMON01478,MENU000332,9,Power suggest religious act.,0,DONDAT1907
CTMON01479,MENU000018,3,Force site ever accept the serious.,0,DONDAT0690
CTMON01480,MENU000061,10,North low act among already young summer great.,0,DONDAT0212
CTMON01481,MENU000281,1,Medical type lay community general.,0,DONDAT0055
CTMON01482,MENU000011,10,Health during sound parent less step.,0,DONDAT1209
CTMON01483,MENU000299,7,Especially president never color trial chair pull.,0,DONDAT0613
CTMON01484,MENU000289,8,Together ever other raise include.,0,DONDAT1046
CTMON01485,MENU000146,9,Beyond easy conference city could sign fact.,0,DONDAT1926
CTMON01486,MENU000196,3,Play lawyer health majority the successful successful.,0,DONDAT2506
CTMON01487,MENU000268,8,Public indeed mean.,0,DONDAT0278
CTMON01488,MENU000436,5,Product local general much.,0,DONDAT2927
CTMON01489,MENU000274,6,On possible throw me a.,0,DONDAT1433
CTMON01490,MENU000288,9,Well same fly again group.,0,DONDAT1319
CTMON01491,MENU000266,9,Close still billion fly.,0,DONDAT0374
CTMON01492,MENU000400,5,Too discussion cost phone step beautiful hotel.,0,DONDAT2104
CTMON01493,MENU000480,10,Floor color government.,0,DONDAT1197
CTMON01494,MENU000039,6,Seek item whose continue.,0,DONDAT1151
CTMON01495,MENU000377,2,Lay across painting player production.,0,DONDAT1068
CTMON01496,MENU000500,3,Education work care animal religious create stock.,0,DONDAT2624
CTMON01497,MENU000184,6,Join voice mouth product it determine.,0,DONDAT2786
CTMON01498,MENU000063,8,Happen fast condition generation direction decade anyone.,0,DONDAT2687
CTMON01499,MENU000323,4,Government affect tonight different make morning forward.,0,DONDAT1789
CTMON01500,MENU000115,2,This them effort stop lay child note.,0,DONDAT2579
CTMON01501,MENU000521,9,College summer truth care want edge though air.,0,DONDAT2628
CTMON01502,MENU000259,1,Ball course address final simple toward face.,0,DONDAT0854
CTMON01503,MENU000183,5,Military table word end value consider.,0,DONDAT2222
CTMON01504,MENU000074,3,Glass feeling ground speak for bit structure.,0,DONDAT0144
CTMON01505,MENU000031,7,Person say lot drop theory gun media answer.,0,DONDAT0077
CTMON01506,MENU000452,9,Election always third operation there pattern though.,0,DONDAT0117
CTMON01507,MENU000177,4,Late around common each.,0,DONDAT0230
CTMON01508,MENU000031,1,Event very your image.,0,DONDAT0668
CTMON01509,MENU000428,4,Bring federal you.,0,DONDAT2491
CTMON01510,MENU000287,3,Thought drive kitchen discuss ago improve kind cultural.,0,DONDAT0312
CTMON01511,MENU000201,9,Their television choose.,0,DONDAT0818
CTMON01512,MENU000111,1,Happen go try green serve see air.,0,DONDAT1915
CTMON01513,MENU000474,5,Name relationship special recognize.,0,DONDAT0930
CTMON01514,MENU000543,4,Pull go might another country.,0,DONDAT1785
CTMON01515,MENU000442,7,Any main recently three class none.,0,DONDAT1608
CTMON01516,MENU000077,5,No glass stop the player really.,0,DONDAT1094
CTMON01517,MENU000318,1,Religious few class nor suddenly institution.,0,DONDAT2281
CTMON01518,MENU000516,8,Response professional ground fish specific citizen fine.,0,DONDAT1434
CTMON01519,MENU000538,10,Rise hit shoulder full road.,0,DONDAT0248
CTMON01520,MENU000121,3,Head listen data.,0,DONDAT2418
CTMON01521,MENU000231,9,Any brother develop medical out style send.,0,DONDAT0015
CTMON01522,MENU000410,1,Strong court particularly Republican.,0,DONDAT2625
CTMON01523,MENU000053,7,Would whatever because.,0,DONDAT0159
CTMON01524,MENU000033,10,Rate him conference choice to site.,0,DONDAT0171
CTMON01525,MENU000331,7,Goal nor knowledge goal on generation arm.,0,DONDAT2996
CTMON01526,MENU000531,9,This wind hour because hear head pull.,0,DONDAT1192
CTMON01527,MENU000152,3,Common car many animal song experience though.,0,DONDAT1191
CTMON01528,MENU000523,3,Yet effort speech again fund watch level.,0,DONDAT1285
CTMON01529,MENU000030,8,Provide popular general prove.,0,DONDAT0806
CTMON01530,MENU000315,5,Television development hotel either but probably.,0,DONDAT2191
CTMON01531,MENU000573,9,Morning role recognize investment offer indeed.,0,DONDAT1960
CTMON01532,MENU000162,10,Try left son sea well weight.,0,DONDAT1577
CTMON01533,MENU000129,2,Deep social not ok none newspaper.,0,DONDAT0774
CTMON01534,MENU000037,1,Kid offer long less.,0,DONDAT2305
CTMON01535,MENU000444,4,Base season money.,0,DONDAT1591
CTMON01536,MENU000206,4,Democrat even especially assume set order couple.,0,DONDAT1643
CTMON01537,MENU000087,7,Consumer position customer understand want wonder.,0,DONDAT2102
CTMON01538,MENU000380,8,Necessary sign car.,0,DONDAT2042
CTMON01539,MENU000089,6,Start cell important account story.,0,DONDAT2469
CTMON01540,MENU000331,8,Interest down property media unit.,0,DONDAT2060
CTMON01541,MENU000124,2,Staff product physical.,0,DONDAT1145
CTMON01542,MENU000549,9,Expect boy nation trouble decision rest.,0,DONDAT2380
CTMON01543,MENU000295,2,Area adult national movie.,0,DONDAT1737
CTMON01544,MENU000502,10,Power once government issue less.,0,DONDAT0731
CTMON01545,MENU000117,1,Turn professional little.,0,DONDAT1626
CTMON01546,MENU000480,2,On traditional floor manager government.,0,DONDAT0583
CTMON01547,MENU000328,7,Their high center.,0,DONDAT2048
CTMON01548,MENU000404,9,White every no three a road.,0,DONDAT1065
CTMON01549,MENU000110,2,Reason tonight wait stock air again conference.,0,DONDAT1924
CTMON01550,MENU000221,5,Language what front.,0,DONDAT1137
CTMON01551,MENU000574,1,Experience campaign lay Republican story say lead.,0,DONDAT1599
CTMON01552,MENU000298,5,Plan would accept drop wait bill.,0,DONDAT0341
CTMON01553,MENU000247,9,Through development thought clearly future administration mention.,0,DONDAT0976
CTMON01554,MENU000352,7,Member how exist new account behind.,0,DONDAT0773
CTMON01555,MENU000145,3,Health Democrat follow policy bank south.,0,DONDAT0562
CTMON01556,MENU000148,10,Yourself else country movie candidate it.,0,DONDAT0706
CTMON01557,MENU000131,9,Class along rather under hair message.,0,DONDAT2665
CTMON01558,MENU000472,2,Artist continue identify reduce behavior.,0,DONDAT2505
CTMON01559,MENU000342,5,Hospital amount space performance apply leg rock.,0,DONDAT0863
CTMON01560,MENU000430,5,Vote face coach marriage natural religious.,0,DONDAT2400
CTMON01561,MENU000531,9,Interesting partner see shake box.,0,DONDAT2492
CTMON01562,MENU000448,1,Together PM usually its result factor suffer.,0,DONDAT2539
CTMON01563,MENU000149,2,Nature manager at fast scientist cold call.,0,DONDAT1233
CTMON01564,MENU000025,2,Feel play cultural candidate instead.,0,DONDAT0823
CTMON01565,MENU000167,2,Product deep summer join.,0,DONDAT0210
CTMON01566,MENU000482,5,Reach project school but purpose.,0,DONDAT1822
CTMON01567,MENU000332,3,Detail collection white much during identify.,0,DONDAT0047
CTMON01568,MENU000088,5,Condition result sea another any treat.,0,DONDAT2433
CTMON01569,MENU000026,10,Among simply blue.,0,DONDAT1411
CTMON01570,MENU000365,7,General pick hand paper indeed style thus.,0,DONDAT2673
CTMON01571,MENU000436,8,More down big.,0,DONDAT0621
CTMON01572,MENU000529,2,Sign daughter cost decision study police career.,0,DONDAT2176
CTMON01573,MENU000599,2,Rich six certain glass senior.,0,DONDAT2605
CTMON01574,MENU000586,8,Film anyone voice trouble seem late.,0,DONDAT0992
CTMON01575,MENU000020,6,Good operation leave head participant prevent break evening.,0,DONDAT0408
CTMON01576,MENU000327,5,Behavior life detail sound great could and.,0,DONDAT1752
CTMON01577,MENU000434,6,Interview born maybe.,0,DONDAT1690
CTMON01578,MENU000584,7,Expert community six nor answer simple.,0,DONDAT2417
CTMON01579,MENU000081,3,Over trouble various process.,0,DONDAT2965
CTMON01580,MENU000356,7,Manage religious event front land run.,0,DONDAT2712
CTMON01581,MENU000453,7,Guy thank expect prepare drug walk.,0,DONDAT1826
CTMON01582,MENU000455,5,Read huge shoulder particularly.,0,DONDAT0292
CTMON01583,MENU000563,1,Easy she wait blood.,0,DONDAT2016
CTMON01584,MENU000399,9,All five white various.,0,DONDAT2572
CTMON01585,MENU000329,6,Democratic very challenge determine left first own.,0,DONDAT0026
CTMON01586,MENU000516,9,Church stock find challenge network.,0,DONDAT0121
CTMON01587,MENU000538,4,One call with particular democratic surface dog.,0,DONDAT2388
CTMON01588,MENU000243,1,Forward budget ready reduce my southern.,0,DONDAT2177
CTMON01589,MENU000061,5,Increase certainly nice bring.,0,DONDAT0197
CTMON01590,MENU000552,3,Language account middle board none.,0,DONDAT1350
CTMON01591,MENU000130,8,I program course message.,0,DONDAT2603
CTMON01592,MENU000566,3,Trip man same.,0,DONDAT1771
CTMON01593,MENU000039,9,Police interview during culture future now only.,0,DONDAT0474
CTMON01594,MENU000358,4,Compare suggest company.,0,DONDAT0905
CTMON01595,MENU000454,7,Quality bank while trial young.,0,DONDAT2051
CTMON01596,MENU000243,5,Hold or amount.,0,DONDAT1699
CTMON01597,MENU000438,10,Hundred weight value age class economy recognize.,0,DONDAT1681
CTMON01598,MENU000148,9,Student west through may born growth you.,0,DONDAT0349
CTMON01599,MENU000057,6,Draw north free.,0,DONDAT2971
CTMON01600,MENU000377,1,Forget force between reveal consumer.,0,DONDAT1846
CTMON01601,MENU000164,6,Hope why public evening.,0,DONDAT1783
CTMON01602,MENU000182,5,Much compare purpose choice case.,0,DONDAT2466
CTMON01603,MENU000583,1,Congress between per senior.,0,DONDAT2573
CTMON01604,MENU000452,5,Become have set attorney camera bank.,0,DONDAT0556
CTMON01605,MENU000593,2,Around model event remember official.,0,DONDAT1312
CTMON01606,MENU000358,4,Card thus beat he five.,0,DONDAT1130
CTMON01607,MENU000383,2,Technology sign remain.,0,DONDAT0695
CTMON01608,MENU000182,9,To ball certainly hotel value international else.,0,DONDAT2102
CTMON01609,MENU000483,10,Paper year give song.,0,DONDAT2703
CTMON01610,MENU000020,9,World stock better prevent.,0,DONDAT0844
CTMON01611,MENU000590,7,Movement everybody free general building camera rise.,0,DONDAT2225
CTMON01612,MENU000100,2,Already modern yourself politics research bill.,0,DONDAT2058
CTMON01613,MENU000003,7,Cut my test option study add growth.,0,DONDAT0455
CTMON01614,MENU000335,6,Grow resource party.,0,DONDAT1155
CTMON01615,MENU000063,6,Something drug popular majority analysis contain.,0,DONDAT0703
CTMON01616,MENU000404,10,Society task activity weight science politics tell.,0,DONDAT0465
CTMON01617,MENU000174,3,Nation bad place return science.,0,DONDAT1158
CTMON01618,MENU000424,6,Data college exactly turn.,0,DONDAT2424
CTMON01619,MENU000354,4,Medical laugh front safe particular apply entire.,0,DONDAT0828
CTMON01620,MENU000234,5,Husband memory medical drug.,0,DONDAT1397
CTMON01621,MENU000542,2,Involve reason entire agent case person special.,0,DONDAT1486
CTMON01622,MENU000596,2,Without eat challenge plant.,0,DONDAT0425
CTMON01623,MENU000477,6,Better evidence any arm.,0,DONDAT1004
CTMON01624,MENU000182,8,Onto statement over around century center.,0,DONDAT0438
CTMON01625,MENU000299,8,Performance audience imagine including have.,0,DONDAT0963
CTMON01626,MENU000172,6,Trial sell trial fire decide price girl.,0,DONDAT0598
CTMON01627,MENU000149,3,Strategy hard prepare determine dinner keep.,0,DONDAT0127
CTMON01628,MENU000563,6,Detail collection car look catch blue.,0,DONDAT0786
CTMON01629,MENU000530,5,First sure country kind.,0,DONDAT1052
CTMON01630,MENU000148,6,Raise happy term official.,0,DONDAT0608
CTMON01631,MENU000101,2,Situation raise field name push way effort.,0,DONDAT2358
CTMON01632,MENU000077,2,Firm boy section ahead card high option.,0,DONDAT2052
CTMON01633,MENU000327,1,During worry couple idea.,0,DONDAT2770
CTMON01634,MENU000410,7,What scientist individual garden health large.,0,DONDAT1840
CTMON01635,MENU000216,10,Actually major stock.,0,DONDAT2957
CTMON01636,MENU000417,6,Join serious than fall brother stay involve.,0,DONDAT0754
CTMON01637,MENU000546,2,State nor few source daughter according.,0,DONDAT0300
CTMON01638,MENU000111,9,Place all purpose.,0,DONDAT0872
CTMON01639,MENU000476,2,Just at amount first.,0,DONDAT2870
CTMON01640,MENU000581,9,Explain word their.,0,DONDAT1631
CTMON01641,MENU000016,8,Approach general provide high.,0,DONDAT1719
CTMON01642,MENU000201,8,Note dark part data you.,0,DONDAT2301
CTMON01643,MENU000487,7,War inside whose public must sister firm more.,0,DONDAT2265
CTMON01644,MENU000078,1,Dog lay knowledge.,0,DONDAT0456
CTMON01645,MENU000184,8,Decision product born thought.,0,DONDAT1952
CTMON01646,MENU000494,3,Push check marriage support.,0,DONDAT2149
CTMON01647,MENU000169,9,President claim matter site.,0,DONDAT1473
CTMON01648,MENU000071,8,See tell least open.,0,DONDAT1508
CTMON01649,MENU000200,7,Manage loss itself appear.,0,DONDAT1282
CTMON01650,MENU000329,4,Expert scientist cold hour save building.,0,DONDAT0363
CTMON01651,MENU000338,8,Certainly strong security radio so.,0,DONDAT1348
CTMON01652,MENU000168,6,While event guess message.,0,DONDAT1886
CTMON01653,MENU000256,10,Executive at future painting anything.,0,DONDAT2277
CTMON01654,MENU000495,3,Sit game send.,0,DONDAT0090
CTMON01655,MENU000236,9,Organization trip happen mother wide me young.,0,DONDAT0014
CTMON01656,MENU000328,9,Shoulder east price begin.,0,DONDAT2336
CTMON01657,MENU000492,9,Interesting financial plan card your hope recognize recognize.,0,DONDAT2214
CTMON01658,MENU000288,3,Believe remain local subject maintain drug name.,0,DONDAT0446
CTMON01659,MENU000090,9,West seek have front friend.,0,DONDAT2180
CTMON01660,MENU000336,8,Deal technology artist someone under recent center test.,0,DONDAT2994
CTMON01661,MENU000448,7,Car need pick word song focus.,0,DONDAT0186
CTMON01662,MENU000234,2,Election beyond other despite price training meeting.,0,DONDAT0532
CTMON01663,MENU000468,6,Realize note result hand executive seem daughter law.,0,DONDAT1583
CTMON01664,MENU000307,2,Prepare thought lead.,0,DONDAT0509
CTMON01665,MENU000083,4,All finish fire girl participant career.,0,DONDAT2452
CTMON01666,MENU000372,9,Wait south job movie participant writer.,0,DONDAT0945
CTMON01667,MENU000422,5,Fall last wall goal agency.,0,DONDAT1098
CTMON01668,MENU000042,3,Success entire defense.,0,DONDAT2513
CTMON01669,MENU000449,5,Late modern draw agreement teach according industry.,0,DONDAT0644
CTMON01670,MENU000101,4,Fire risk type fund.,0,DONDAT1175
CTMON01671,MENU000528,5,House research beat soldier.,0,DONDAT1908
CTMON01672,MENU000370,3,Anyone anyone should.,0,DONDAT1729
CTMON01673,MENU000095,10,Impact key relate thank majority.,0,DONDAT2588
CTMON01674,MENU000268,9,Bed billion story whom its.,0,DONDAT0422
CTMON01675,MENU000525,7,Line seven war phone second day Republican.,0,DONDAT0919
CTMON01676,MENU000326,9,Begin fish policy idea knowledge.,0,DONDAT2573
CTMON01677,MENU000381,5,Former TV try edge create.,0,DONDAT0695
CTMON01678,MENU000053,4,Wonder debate new such blue.,0,DONDAT0148
CTMON01679,MENU000280,4,Public already month million decision level security.,0,DONDAT0075
CTMON01680,MENU000452,2,Hair meeting every.,0,DONDAT1947
CTMON01681,MENU000559,4,Because analysis ask production.,0,DONDAT1501
CTMON01682,MENU000555,8,Line job staff system four staff.,0,DONDAT2095
CTMON01683,MENU000345,2,Work act kid change.,0,DONDAT2616
CTMON01684,MENU000343,4,Even its result her loss open.,0,DONDAT1698
CTMON01685,MENU000204,2,Guy performance have.,0,DONDAT2339
CTMON01686,MENU000536,5,Beautiful run break physical eye heavy.,0,DONDAT2987
CTMON01687,MENU000591,3,Perform peace both some.,0,DONDAT1946
CTMON01688,MENU000413,8,Finish worker even candidate crime role they.,0,DONDAT0622
CTMON01689,MENU000038,3,Exist off common finish hand.,0,DONDAT1400
CTMON01690,MENU000128,3,Play late marriage popular matter not.,0,DONDAT0898
CTMON01691,MENU000417,7,Through lead vote for group including light.,0,DONDAT1088
CTMON01692,MENU000451,5,Owner none through while stay suffer might.,0,DONDAT0699
CTMON01693,MENU000217,5,Guess region happy relate yeah college significant.,0,DONDAT1029
CTMON01694,MENU000295,7,Animal partner respond blue voice without compare.,0,DONDAT0716
CTMON01695,MENU000011,1,Police space matter central.,0,DONDAT1157
CTMON01696,MENU000405,4,Enjoy often dark develop result drive measure.,0,DONDAT0338
CTMON01697,MENU000276,8,Little lay ability.,0,DONDAT0515
CTMON01698,MENU000492,9,Body well attorney already success president ball.,0,DONDAT2109
CTMON01699,MENU000102,7,City though door statement.,0,DONDAT1055
CTMON01700,MENU000433,1,Other idea although production security worry debate.,0,DONDAT0540
CTMON01701,MENU000365,7,Effect mean population book.,0,DONDAT2374
CTMON01702,MENU000491,8,Name every production outside.,0,DONDAT2221
CTMON01703,MENU000495,9,Score worker natural return career list.,0,DONDAT0168
CTMON01704,MENU000300,5,Visit dinner and produce.,0,DONDAT0322
CTMON01705,MENU000142,7,Suddenly professional say building husband goal.,0,DONDAT0271
CTMON01706,MENU000271,7,No senior she while money new environment.,0,DONDAT2390
CTMON01707,MENU000236,6,Same treatment wear society mother main.,0,DONDAT2387
CTMON01708,MENU000143,9,Project player dream maintain anything.,0,DONDAT1539
CTMON01709,MENU000031,4,With he worker goal movie evening.,0,DONDAT1837
CTMON01710,MENU000463,10,Box take surface bring.,0,DONDAT0108
CTMON01711,MENU000415,5,Personal election table education base feeling.,0,DONDAT0302
CTMON01712,MENU000177,10,Author tend prepare door her compare receive.,0,DONDAT1358
CTMON01713,MENU000492,6,Seat write after produce everybody institution.,0,DONDAT2919
CTMON01714,MENU000433,5,Religious most clear six.,0,DONDAT0366
CTMON01715,MENU000158,7,Including performance treatment create.,0,DONDAT2058
CTMON01716,MENU000563,6,Beautiful various leader modern continue last article.,0,DONDAT0682
CTMON01717,MENU000037,8,Hospital father environment either total baby development water.,0,DONDAT0756
CTMON01718,MENU000268,10,Begin could number property employee sell foreign.,0,DONDAT1917
CTMON01719,MENU000437,7,Meet yet sign security down.,0,DONDAT0526
CTMON01720,MENU000438,6,Operation rich enter.,0,DONDAT1132
CTMON01721,MENU000441,9,Quite price method well.,0,DONDAT0376
CTMON01722,MENU000551,1,Authority near feeling.,0,DONDAT0135
CTMON01723,MENU000122,2,Bit feeling challenge beat at owner.,0,DONDAT0302
CTMON01724,MENU000313,10,Physical mention today she analysis dark anything simple.,0,DONDAT2211
CTMON01725,MENU000529,7,Clear interest less here administration computer.,0,DONDAT2261
CTMON01726,MENU000315,3,Party recent apply home education bank.,0,DONDAT1723
CTMON01727,MENU000076,1,Perform benefit light entire.,0,DONDAT0746
CTMON01728,MENU000228,7,Yeah health cultural finish nor.,0,DONDAT2522
CTMON01729,MENU000142,2,Baby form radio.,0,DONDAT1900
CTMON01730,MENU000277,1,Should officer law number.,0,DONDAT0238
CTMON01731,MENU000582,7,Early guy as from myself.,0,DONDAT1381
CTMON01732,MENU000229,4,Attack trip break sell two.,0,DONDAT2432
CTMON01733,MENU000219,6,Growth as build quickly.,0,DONDAT2539
CTMON01734,MENU000438,9,Arm physical mother.,0,DONDAT0283
CTMON01735,MENU000392,3,Treat control interesting.,0,DONDAT1765
CTMON01736,MENU000307,10,Ever return western accept our tree he.,0,DONDAT2842
CTMON01737,MENU000234,3,Growth approach carry bit.,0,DONDAT0737
CTMON01738,MENU000212,6,Able over training war.,0,DONDAT0520
CTMON01739,MENU000506,9,Push top such source officer.,0,DONDAT2587
CTMON01740,MENU000221,5,Tell without picture few floor no.,0,DONDAT1987
CTMON01741,MENU000482,1,Its look rock realize music data approach.,0,DONDAT1681
CTMON01742,MENU000171,7,School president cover physical report.,0,DONDAT0056
CTMON01743,MENU000412,3,Grow make past senior television chair.,0,DONDAT2192
CTMON01744,MENU000101,7,Short consider no few appear national plan.,0,DONDAT2360
CTMON01745,MENU000028,9,Cut structure yourself work manage almost.,0,DONDAT0801
CTMON01746,MENU000295,1,Yeah community together score whom.,0,DONDAT0175
CTMON01747,MENU000299,6,Little resource life certain when party task.,0,DONDAT2014
CTMON01748,MENU000032,4,They model affect effort.,0,DONDAT2982
CTMON01749,MENU000130,9,Success western maintain field bar base determine.,0,DONDAT0203
CTMON01750,MENU000030,10,City rule check doctor yes fish ten.,0,DONDAT1600
CTMON01751,MENU000200,7,Forward now seem.,0,DONDAT0468
CTMON01752,MENU000025,7,Energy month activity occur.,0,DONDAT0057
CTMON01753,MENU000563,6,These many sister big be.,0,DONDAT1451
CTMON01754,MENU000349,7,Face community increase paper staff within responsibility.,0,DONDAT1536
