MACTMON,MAMENU,SOLUONG,GHICHU,DONGIATONG,MADONDATMON
CTMON00001,MENU000518,8,Offer either effect news final word.,0,DONDAT2557
CTMON00002,MENU000025,5,Onto pass special leg responsibility my.,0,DONDAT2847
CTMON00003,MENU000135,2,Town way over far.,0,DONDAT0770
CTMON00004,MENU000359,8,Best hand total less good.,0,DONDAT0114
CTMON00005,MENU000573,8,Become meet employee its response whether product.,0,DONDAT1552
CTMON00006,MENU000457,10,Environmental buy final several.,0,DONDAT1260
CTMON00007,MENU000205,5,Side and business prove recent.,0,DONDAT1359
CTMON00008,MENU000521,8,Think plant side which note.,0,DONDAT1187
CTMON00009,MENU000149,3,Product almost month wife without yes other.,0,DONDAT0772
CTMON00010,MENU000256,9,Must contain voice.,0,DONDAT1129
CTMON00011,MENU000378,8,Responsibility shake quality available.,0,DONDAT2888
CTMON00012,MENU000231,9,Could century option face tough wait.,0,DONDAT2283
CTMON00013,MENU000293,8,Recognize letter girl owner green.,0,DONDAT1173
CTMON00014,MENU000430,7,Hard visit information word people.,0,DONDAT0710
CTMON00015,MENU000488,7,Board home myself describe head live.,0,DONDAT1107
CTMON00016,MENU000140,4,Evidence black occur live.,0,DONDAT0398
CTMON00017,MENU000232,3,Career investment feel media significant.,0,DONDAT0854
CTMON00018,MENU000260,8,Green Mr production indeed attention population specific nor.,0,DONDAT0899
CTMON00019,MENU000365,2,Same early wife start nature any.,0,DONDAT0693
CTMON00020,MENU000137,6,Ok once positive Democrat.,0,DONDAT2959
CTMON00021,MENU000019,4,Tv across none start example member perform sometimes.,0,DONDAT0433
CTMON00022,MENU000297,7,City door ahead hope development upon hot.,0,DONDAT2260
CTMON00023,MENU000263,9,Part low development body conference take.,0,DONDAT2184
CTMON00024,MENU000232,5,Happen reason trouble west develop visit.,0,DONDAT2348
CTMON00025,MENU000486,8,Hotel major return.,0,DONDAT1139
CTMON00026,MENU000127,8,Newspaper friend everything reveal who.,0,DONDAT2095
CTMON00027,MENU000138,3,Receive matter chance conference attorney model cup.,0,DONDAT0691
CTMON00028,MENU000086,10,Reality meeting significant study method media official.,0,DONDAT1363
CTMON00029,MENU000008,5,Her up social draw act our.,0,DONDAT0616
CTMON00030,MENU000012,2,Find recently hand law sea garden.,0,DONDAT0992
CTMON00031,MENU000457,6,Involve could catch series.,0,DONDAT1797
CTMON00032,MENU000177,10,Growth computer kitchen from.,0,DONDAT2961
CTMON00033,MENU000393,8,Teach evidence or executive.,0,DONDAT1268
CTMON00034,MENU000364,7,Agent wish east claim article challenge.,0,DONDAT1187
CTMON00035,MENU000008,3,Evidence travel off already indicate customer.,0,DONDAT0597
CTMON00036,MENU000494,4,Century so room production civil morning unit identify.,0,DONDAT0436
CTMON00037,MENU000258,3,Worker pretty trip.,0,DONDAT0347
CTMON00038,MENU000542,7,Individual put network concern each film.,0,DONDAT1135
CTMON00039,MENU000276,9,Myself ten knowledge nothing art most source.,0,DONDAT2954
CTMON00040,MENU000233,3,Reflect attack rock something truth could.,0,DONDAT0193
CTMON00041,MENU000470,6,Quickly if she as soldier soon.,0,DONDAT0467
CTMON00042,MENU000146,3,Do control sing walk.,0,DONDAT1839
CTMON00043,MENU000341,10,Television seat leader particularly billion.,0,DONDAT2882
CTMON00044,MENU000349,7,Study arrive site decision.,0,DONDAT2625
CTMON00045,MENU000235,3,Defense box event degree wish resource.,0,DONDAT2983
CTMON00046,MENU000578,7,Then prove process control less.,0,DONDAT1530
CTMON00047,MENU000386,3,Amount must such size one few.,0,DONDAT1498
CTMON00048,MENU000057,4,Single might themselves despite.,0,DONDAT0611
CTMON00049,MENU000189,6,Their when sea apply.,0,DONDAT1807
CTMON00050,MENU000359,1,Field fact face trade.,0,DONDAT1445
CTMON00051,MENU000479,4,Apply claim camera why.,0,DONDAT1828
CTMON00052,MENU000288,3,Thank cell discover see way explain.,0,DONDAT0134
CTMON00053,MENU000405,9,Factor its behavior show affect.,0,DONDAT0003
CTMON00054,MENU000320,2,Month to training section.,0,DONDAT1419
CTMON00055,MENU000368,2,Hit security hour authority where half much.,0,DONDAT0973
CTMON00056,MENU000444,9,Couple live discussion.,0,DONDAT0776
CTMON00057,MENU000542,1,Deal movie threat deep.,0,DONDAT1746
CTMON00058,MENU000410,2,Age determine air from direction blood.,0,DONDAT0957
CTMON00059,MENU000128,5,There at office reason experience cover finish.,0,DONDAT1349
CTMON00060,MENU000139,6,Set hit by none pressure arm option.,0,DONDAT0948
CTMON00061,MENU000051,4,Own they senior side describe.,0,DONDAT1690
CTMON00062,MENU000511,9,Food against word window industry beyond trip.,0,DONDAT1742
CTMON00063,MENU000093,1,Industry cause accept situation.,0,DONDAT0949
CTMON00064,MENU000582,4,Provide treatment whom available save.,0,DONDAT0358
CTMON00065,MENU000078,3,Young stand economy within base question.,0,DONDAT2195
CTMON00066,MENU000130,2,Movie skill stop discussion man.,0,DONDAT2222
CTMON00067,MENU000280,1,Share such production step follow.,0,DONDAT1795
CTMON00068,MENU000443,4,Evidence five seek thus both development interview.,0,DONDAT2058
CTMON00069,MENU000294,2,Authority send result market bad.,0,DONDAT2436
CTMON00070,MENU000591,9,Since account suddenly Democrat rise.,0,DONDAT0754
CTMON00071,MENU000262,10,Girl fund growth system camera.,0,DONDAT1592
CTMON00072,MENU000482,3,Democrat where lawyer partner hot.,0,DONDAT2005
CTMON00073,MENU000286,6,Walk soldier trade.,0,DONDAT0484
CTMON00074,MENU000395,5,Nature might focus president full case.,0,DONDAT1184
CTMON00075,MENU000224,3,Newspaper director miss prevent speech.,0,DONDAT1356
CTMON00076,MENU000219,6,Help project ago Congress matter security.,0,DONDAT1452
CTMON00077,MENU000403,10,Capital east nation entire.,0,DONDAT0658
CTMON00078,MENU000235,1,Car indicate within I policy effect.,0,DONDAT0605
CTMON00079,MENU000590,4,Industry call thus pass.,0,DONDAT2745
CTMON00080,MENU000200,10,Fight factor street environment.,0,DONDAT2753
CTMON00081,MENU000291,3,Listen later tonight along.,0,DONDAT0227
CTMON00082,MENU000473,1,Home challenge stage from final.,0,DONDAT1767
CTMON00083,MENU000382,3,Though believe serious.,0,DONDAT0613
CTMON00084,MENU000360,8,Indicate TV drop research.,0,DONDAT0269
CTMON00085,MENU000188,5,Wrong detail leader when painting become.,0,DONDAT0720
CTMON00086,MENU000435,5,Discover decide moment.,0,DONDAT1756
CTMON00087,MENU000564,2,Interest agreement clearly conference.,0,DONDAT1034
CTMON00088,MENU000417,9,Test poor us.,0,DONDAT0686
CTMON00089,MENU000075,10,Positive involve read.,0,DONDAT0970
CTMON00090,MENU000190,4,Full current grow career clear foreign wear position.,0,DONDAT1742
CTMON00091,MENU000378,10,Notice kind rate third.,0,DONDAT0464
CTMON00092,MENU000006,8,Baby one government successful.,0,DONDAT1286
CTMON00093,MENU000027,6,Black about left product note step.,0,DONDAT1530
CTMON00094,MENU000503,10,Sister service result agent about improve different final.,0,DONDAT0702
CTMON00095,MENU000352,5,Clear computer or down north television.,0,DONDAT2213
CTMON00096,MENU000590,2,Authority hot just traditional.,0,DONDAT2986
CTMON00097,MENU000538,5,Own reality protect food down.,0,DONDAT1498
CTMON00098,MENU000180,1,From deep open believe.,0,DONDAT1475
CTMON00099,MENU000235,10,May tend bar cup with step.,0,DONDAT2257
CTMON00100,MENU000129,10,Effect season nature travel property approach idea.,0,DONDAT0543
CTMON00101,MENU000066,2,Subject learn front stuff ago over concern.,0,DONDAT0425
CTMON00102,MENU000278,4,Smile glass analysis address plan half recently.,0,DONDAT0384
CTMON00103,MENU000054,3,House usually I team fear total.,0,DONDAT1265
CTMON00104,MENU000008,9,Find great increase around also mission.,0,DONDAT0986
CTMON00105,MENU000408,3,International carry catch back heart understand.,0,DONDAT1463
CTMON00106,MENU000247,8,Push success really radio high news.,0,DONDAT1356
CTMON00107,MENU000526,9,Ability candidate their.,0,DONDAT1368
CTMON00108,MENU000148,10,Fly best ever enter.,0,DONDAT2072
CTMON00109,MENU000168,2,Hard morning middle central player quickly.,0,DONDAT2374
CTMON00110,MENU000326,1,Stay bed standard try never reach best herself.,0,DONDAT1123
CTMON00111,MENU000396,5,Treatment someone business poor ground professional.,0,DONDAT0106
CTMON00112,MENU000571,7,Boy discussion campaign ask relate.,0,DONDAT1957
CTMON00113,MENU000438,2,Mission deep to tough.,0,DONDAT1429
CTMON00114,MENU000049,4,I water of know product instead produce thank.,0,DONDAT1602
CTMON00115,MENU000400,10,Keep house miss fast film cost late.,0,DONDAT1605
CTMON00116,MENU000289,9,Already factor rest.,0,DONDAT0708
CTMON00117,MENU000182,2,Value nice to spring especially trip effort statement.,0,DONDAT2579
CTMON00118,MENU000292,6,Cost week history certainly word put response similar.,0,DONDAT1333
CTMON00119,MENU000006,10,Send others heart mind central ask.,0,DONDAT2423
CTMON00120,MENU000187,1,Blood scientist bank church send rate west black.,0,DONDAT0119
CTMON00121,MENU000527,8,Education federal not single yet wrong economy.,0,DONDAT2594
CTMON00122,MENU000435,7,Worker out painting poor present street education.,0,DONDAT0830
CTMON00123,MENU000542,8,Loss part happen ok window gun fire.,0,DONDAT0103
CTMON00124,MENU000565,2,Financial card themselves hand fear.,0,DONDAT2925
CTMON00125,MENU000023,10,Yes but off reach compare fast better.,0,DONDAT2804
CTMON00126,MENU000467,1,Compare four box.,0,DONDAT0569
CTMON00127,MENU000529,10,Arrive teach American suffer worker deep because.,0,DONDAT0230
CTMON00128,MENU000532,3,Candidate happen thousand Republican exist involve.,0,DONDAT0139
CTMON00129,MENU000273,4,Director manage face stay low even.,0,DONDAT2727
CTMON00130,MENU000355,8,Likely leave run rich.,0,DONDAT1758
CTMON00131,MENU000231,7,Stop bank soldier eight affect general our.,0,DONDAT1586
CTMON00132,MENU000001,2,Decision drug believe remember later well maintain.,0,DONDAT1159
CTMON00133,MENU000061,5,President practice left hair treatment.,0,DONDAT1115
CTMON00134,MENU000363,8,Short century former again want situation.,0,DONDAT1149
CTMON00135,MENU000176,1,Three thing election.,0,DONDAT2410
CTMON00136,MENU000187,6,Trade strategy moment worry.,0,DONDAT1029
CTMON00137,MENU000398,3,Total eight seven together glass.,0,DONDAT2937
CTMON00138,MENU000440,8,Herself wrong environment.,0,DONDAT1457
CTMON00139,MENU000318,9,Value part wish despite again million.,0,DONDAT1820
CTMON00140,MENU000063,2,Who stuff west hit after Mrs task against.,0,DONDAT2556
CTMON00141,MENU000036,3,Boy her across heart must resource building arm.,0,DONDAT2442
CTMON00142,MENU000233,2,Mouth natural treatment full past across.,0,DONDAT2410
CTMON00143,MENU000100,7,Future over glass talk.,0,DONDAT1623
CTMON00144,MENU000304,4,Vote expert report area.,0,DONDAT1689
CTMON00145,MENU000577,6,Store contain both pull adult.,0,DONDAT0858
CTMON00146,MENU000151,4,Result among month senior coach front.,0,DONDAT1072
CTMON00147,MENU000092,1,Front this visit against east defense side something.,0,DONDAT0711
CTMON00148,MENU000109,4,Age later whom professional treat report main.,0,DONDAT0882
CTMON00149,MENU000540,10,Executive ability her party enough friend value.,0,DONDAT1339
CTMON00150,MENU000313,4,Dinner marriage movie order idea bill traditional.,0,DONDAT0989
CTMON00151,MENU000545,7,Then call follow human art whatever.,0,DONDAT2802
CTMON00152,MENU000090,2,Near deal its Mr woman.,0,DONDAT0594
CTMON00153,MENU000485,7,Find will audience player still hope young.,0,DONDAT2759
CTMON00154,MENU000177,10,Agent down environmental mother change but partner.,0,DONDAT0711
CTMON00155,MENU000362,5,True research before simply since.,0,DONDAT2119
CTMON00156,MENU000198,3,Run stock voice establish baby.,0,DONDAT1119
CTMON00157,MENU000589,10,Than if author parent.,0,DONDAT2446
CTMON00158,MENU000478,9,Risk save leg kid.,0,DONDAT0497
CTMON00159,MENU000409,9,Book carry represent.,0,DONDAT2717
CTMON00160,MENU000297,2,Research nice to necessary.,0,DONDAT2946
CTMON00161,MENU000217,9,Machine seem issue everything cover baby.,0,DONDAT0623
CTMON00162,MENU000326,3,Teach field design involve think family close.,0,DONDAT0886
CTMON00163,MENU000477,8,Major up daughter beyond agent window else admit.,0,DONDAT0006
CTMON00164,MENU000283,6,Pass clearly candidate fund part woman would.,0,DONDAT1000
CTMON00165,MENU000137,10,Together Mrs easy together until another.,0,DONDAT1899
CTMON00166,MENU000303,8,Personal few order social such sport trade boy.,0,DONDAT1928
CTMON00167,MENU000065,4,Need turn on hour somebody high serious.,0,DONDAT0804
CTMON00168,MENU000019,7,True compare company finish scientist.,0,DONDAT1085
CTMON00169,MENU000382,1,Out trial stuff Democrat business.,0,DONDAT1179
CTMON00170,MENU000055,2,Check six improve fight job general store before.,0,DONDAT0229
CTMON00171,MENU000435,6,Practice after part detail president woman get.,0,DONDAT1938
CTMON00172,MENU000199,7,Machine statement miss yourself front.,0,DONDAT2881
CTMON00173,MENU000358,9,Cup democratic each kid I speak.,0,DONDAT1754
CTMON00174,MENU000248,10,Message relate conference seven.,0,DONDAT0668
CTMON00175,MENU000472,3,Artist increase himself help life politics majority year.,0,DONDAT1754
CTMON00176,MENU000203,1,Wear manage space industry kind let.,0,DONDAT1274
CTMON00177,MENU000029,6,Next north time may prove degree loss candidate.,0,DONDAT1322
CTMON00178,MENU000496,9,Side reduce team response.,0,DONDAT1355
CTMON00179,MENU000428,8,Age course front pay hard.,0,DONDAT2165
CTMON00180,MENU000453,10,Third without hit Congress growth account.,0,DONDAT0769
CTMON00181,MENU000555,4,Performance his choice house however itself.,0,DONDAT0001
CTMON00182,MENU000090,6,Anything suddenly paper read mean cut arrive.,0,DONDAT0823
CTMON00183,MENU000005,8,Factor available low action black.,0,DONDAT0222
CTMON00184,MENU000500,7,Region artist sound age far soldier.,0,DONDAT0575
CTMON00185,MENU000257,8,Seem wife almost new plant because.,0,DONDAT1229
CTMON00186,MENU000141,5,Open new mention.,0,DONDAT2102
CTMON00187,MENU000553,3,Off present foreign ball Congress policy.,0,DONDAT0157
CTMON00188,MENU000527,6,The lose matter pattern help trial local.,0,DONDAT1683
CTMON00189,MENU000384,2,Determine only many rule available.,0,DONDAT1096
CTMON00190,MENU000418,10,Western even still onto soldier evidence.,0,DONDAT2210
CTMON00191,MENU000232,2,Rate magazine full serious.,0,DONDAT1485
CTMON00192,MENU000119,7,Yourself change hundred finally bank my.,0,DONDAT2333
CTMON00193,MENU000511,10,Organization continue computer five a phone worry.,0,DONDAT2979
CTMON00194,MENU000038,6,Unit approach why serve in television woman.,0,DONDAT0117
CTMON00195,MENU000076,9,Health seem growth hospital soon live work.,0,DONDAT1212
CTMON00196,MENU000345,10,Pretty force imagine maybe return million wait student.,0,DONDAT2964
CTMON00197,MENU000393,4,Tax ready still significant blue answer.,0,DONDAT2927
CTMON00198,MENU000537,9,Born area card eight them Mr.,0,DONDAT1831
CTMON00199,MENU000501,8,Day human learn partner approach opportunity.,0,DONDAT2329
CTMON00200,MENU000369,6,Let call street yes talk reality.,0,DONDAT2467
CTMON00201,MENU000220,2,Recently instead keep official.,0,DONDAT2865
CTMON00202,MENU000249,9,Drop hit street.,0,DONDAT1727
CTMON00203,MENU000139,5,Indeed possible institution edge too high personal.,0,DONDAT1430
CTMON00204,MENU000293,1,After lose can idea.,0,DONDAT0080
CTMON00205,MENU000526,2,Church certain word hour wife.,0,DONDAT0370
CTMON00206,MENU000591,1,Mr audience north until attack.,0,DONDAT2732
CTMON00207,MENU000073,3,Charge either development take six sea yet.,0,DONDAT0392
CTMON00208,MENU000208,8,Road institution baby who professional south.,0,DONDAT0346
CTMON00209,MENU000493,3,On practice size building modern develop.,0,DONDAT2949
CTMON00210,MENU000598,9,You course author husband party either.,0,DONDAT0901
CTMON00211,MENU000023,5,Require stock early high determine old recognize.,0,DONDAT1491
CTMON00212,MENU000021,8,Evidence clearly lay hard about affect continue.,0,DONDAT0248
CTMON00213,MENU000509,3,Read him condition truth second top.,0,DONDAT0968
CTMON00214,MENU000453,5,Them among which moment.,0,DONDAT1877
CTMON00215,MENU000321,4,With study yard.,0,DONDAT1328
CTMON00216,MENU000254,8,To enjoy political billion fast resource.,0,DONDAT1131
CTMON00217,MENU000050,8,Shoulder drug if impact common.,0,DONDAT2885
CTMON00218,MENU000256,1,Fly skin condition opportunity.,0,DONDAT2570
CTMON00219,MENU000566,1,Room plant article order wish.,0,DONDAT1369
CTMON00220,MENU000203,10,Like central state challenge think none concern stage.,0,DONDAT2950
CTMON00221,MENU000082,6,Deep coach environmental note support.,0,DONDAT0172
CTMON00222,MENU000155,9,Charge you year age.,0,DONDAT2984
CTMON00223,MENU000128,5,Serious sing the response none.,0,DONDAT0691
CTMON00224,MENU000440,6,Offer control lay.,0,DONDAT1777
CTMON00225,MENU000457,8,Such fast trip.,0,DONDAT0331
CTMON00226,MENU000070,6,Lead prove old population Congress.,0,DONDAT2692
CTMON00227,MENU000322,8,Memory within year want eight why foot.,0,DONDAT0201
CTMON00228,MENU000442,3,Close manager office.,0,DONDAT0883
CTMON00229,MENU000365,6,Religious cultural three happen group.,0,DONDAT2102
CTMON00230,MENU000333,1,Everything take most many size close low.,0,DONDAT2585
CTMON00231,MENU000371,1,Know before some trouble board three.,0,DONDAT0990
CTMON00232,MENU000149,8,Away herself see.,0,DONDAT1675
CTMON00233,MENU000433,8,Late analysis kid inside always.,0,DONDAT1175
CTMON00234,MENU000175,9,Treatment care population admit whole fast.,0,DONDAT1399
CTMON00235,MENU000509,3,Positive six public above he statement police color.,0,DONDAT0645
CTMON00236,MENU000165,1,Front physical or mission walk.,0,DONDAT2230
CTMON00237,MENU000236,4,Style throw month wide often recognize.,0,DONDAT2008
CTMON00238,MENU000283,2,Either similar whole trade.,0,DONDAT1099
CTMON00239,MENU000460,7,Face drop high other face wide family policy.,0,DONDAT0293
CTMON00240,MENU000070,4,Human outside she deal bed show produce.,0,DONDAT0856
CTMON00241,MENU000288,2,Reality hope available for find design.,0,DONDAT1803
CTMON00242,MENU000230,9,Apply hospital money kitchen yes theory husband.,0,DONDAT2245
CTMON00243,MENU000135,9,President across relate remember result.,0,DONDAT1145
CTMON00244,MENU000056,10,Interest best life line cause job main.,0,DONDAT2439
CTMON00245,MENU000239,9,Executive box beat little ability majority listen.,0,DONDAT0817
CTMON00246,MENU000211,6,Majority central surface wind.,0,DONDAT0733
CTMON00247,MENU000594,4,Every improve nation woman move realize.,0,DONDAT0932
CTMON00248,MENU000069,6,Authority less mother.,0,DONDAT2323
CTMON00249,MENU000079,4,Old standard enjoy pass course.,0,DONDAT2874
CTMON00250,MENU000164,6,Civil bad answer imagine.,0,DONDAT2885
CTMON00251,MENU000187,4,Customer else wife all.,0,DONDAT0327
CTMON00252,MENU000482,4,Character million candidate week total develop ever.,0,DONDAT0211
CTMON00253,MENU000568,3,Hotel alone have soldier low.,0,DONDAT1723
CTMON00254,MENU000511,9,Dream will seem answer much.,0,DONDAT1110
CTMON00255,MENU000444,2,Popular race goal five.,0,DONDAT2697
CTMON00256,MENU000147,2,Lay leave voice effort.,0,DONDAT1388
CTMON00257,MENU000066,9,East different look son again.,0,DONDAT2947
CTMON00258,MENU000526,9,Public cut during still case dream.,0,DONDAT1788
CTMON00259,MENU000491,3,Himself body like forget but.,0,DONDAT2564
CTMON00260,MENU000198,8,Blood open once who seat do.,0,DONDAT1597
CTMON00261,MENU000399,2,Anyone help study approach stuff doctor debate.,0,DONDAT2671
CTMON00262,MENU000513,7,Within determine series ago point.,0,DONDAT2744
CTMON00263,MENU000571,2,Step bill free born last list tax.,0,DONDAT0413
CTMON00264,MENU000553,8,Chance back work paper lot item opportunity many.,0,DONDAT1318
CTMON00265,MENU000481,1,Sport debate management sell likely.,0,DONDAT1639
CTMON00266,MENU000455,1,Establish yeah tree.,0,DONDAT1994
CTMON00267,MENU000409,2,Media second quite career myself.,0,DONDAT0991
CTMON00268,MENU000345,1,College his kitchen note production.,0,DONDAT1055
CTMON00269,MENU000225,7,Leave write style last lay.,0,DONDAT2743
CTMON00270,MENU000362,8,Necessary bar she question movement form character.,0,DONDAT0360
CTMON00271,MENU000151,6,Speak change machine expert single be.,0,DONDAT0997
CTMON00272,MENU000554,6,Step when same argue listen team.,0,DONDAT2752
CTMON00273,MENU000551,10,Inside appear have feel discuss.,0,DONDAT0451
CTMON00274,MENU000322,6,Seat address human surface nothing itself tell.,0,DONDAT0895
CTMON00275,MENU000184,6,Treat throw body whose.,0,DONDAT0863
CTMON00276,MENU000171,9,Turn order cause feel investment stand suffer.,0,DONDAT2544
CTMON00277,MENU000478,8,Themselves land down discover military around change.,0,DONDAT1452
CTMON00278,MENU000393,3,Hospital activity network reach.,0,DONDAT2219
CTMON00279,MENU000390,9,Appear edge rise however.,0,DONDAT1357
CTMON00280,MENU000210,7,Tree exist their whose cost maintain message.,0,DONDAT1832
CTMON00281,MENU000426,6,Until left either add.,0,DONDAT2052
CTMON00282,MENU000438,7,Land form over at create owner adult ever.,0,DONDAT2872
CTMON00283,MENU000315,2,Every write picture number everything.,0,DONDAT1110
CTMON00284,MENU000159,4,Thousand I occur name.,0,DONDAT2641
CTMON00285,MENU000212,9,Form speech soldier up phone produce always.,0,DONDAT2206
CTMON00286,MENU000034,4,Better husband authority Mrs hold effort door.,0,DONDAT0571
CTMON00287,MENU000348,1,Because wish join seat face.,0,DONDAT2767
CTMON00288,MENU000247,1,Nation become natural ball.,0,DONDAT0603
CTMON00289,MENU000115,1,Reality where appear such quality mind agree feel.,0,DONDAT2590
CTMON00290,MENU000269,2,Grow best case major care help car.,0,DONDAT1242
CTMON00291,MENU000209,3,Growth born miss box.,0,DONDAT0973
CTMON00292,MENU000251,5,Would building market wrong might assume house.,0,DONDAT2423
CTMON00293,MENU000049,4,Surface degree detail night almost good.,0,DONDAT2996
CTMON00294,MENU000561,7,Wait financial themselves arrive vote.,0,DONDAT2661
CTMON00295,MENU000434,3,Service big performance.,0,DONDAT1839
CTMON00296,MENU000223,9,Indeed big institution give accept class national.,0,DONDAT1397
CTMON00297,MENU000255,7,Sport ground executive run edge try capital although.,0,DONDAT2090
CTMON00298,MENU000035,2,Program accept may money act business strong.,0,DONDAT0851
CTMON00299,MENU000426,5,Debate certainly arrive deep.,0,DONDAT2269
CTMON00300,MENU000087,6,Attack cultural eat some statement evening wonder.,0,DONDAT0482
CTMON00301,MENU000595,7,Someone baby program many real.,0,DONDAT2726
CTMON00302,MENU000026,9,Value loss treat a war box behind behavior.,0,DONDAT1919
CTMON00303,MENU000591,5,Although cost development dog training vote day.,0,DONDAT1061
CTMON00304,MENU000075,8,Trouble nearly make amount so west set result.,0,DONDAT0163
CTMON00305,MENU000077,6,Beyond can doctor probably friend.,0,DONDAT2575
CTMON00306,MENU000227,1,Effect little occur involve seek poor fight.,0,DONDAT1185
CTMON00307,MENU000022,10,Beat factor any garden subject.,0,DONDAT1137
CTMON00308,MENU000081,7,Special score Democrat start child hair.,0,DONDAT1471
CTMON00309,MENU000452,8,Sing firm pass performance cost be.,0,DONDAT2472
CTMON00310,MENU000004,4,Such six mention then thing.,0,DONDAT0674
CTMON00311,MENU000015,3,At four player debate heavy.,0,DONDAT0432
CTMON00312,MENU000040,2,Notice style size box sell girl.,0,DONDAT1108
CTMON00313,MENU000238,5,Owner east usually politics.,0,DONDAT2354
CTMON00314,MENU000272,3,Number attack economy during team race.,0,DONDAT0606
CTMON00315,MENU000540,5,Old later major major.,0,DONDAT2083
CTMON00316,MENU000003,1,Discuss particular player day base bit.,0,DONDAT1981
CTMON00317,MENU000440,2,Yard add force decision base.,0,DONDAT2350
CTMON00318,MENU000153,1,Trial ask nor identify letter project camera down.,0,DONDAT2905
CTMON00319,MENU000453,7,Enter us party network something.,0,DONDAT0648
CTMON00320,MENU000312,4,Professional sure white site.,0,DONDAT2942
CTMON00321,MENU000346,10,Program quickly skill image program yard.,0,DONDAT2422
CTMON00322,MENU000358,9,Rate happy together practice think safe.,0,DONDAT2858
CTMON00323,MENU000246,10,Common line arm.,0,DONDAT0672
CTMON00324,MENU000301,8,Decision use about mouth we positive foreign.,0,DONDAT0575
CTMON00325,MENU000361,1,Beyond rather citizen national theory always exist.,0,DONDAT1675
CTMON00326,MENU000267,8,Position stock action not.,0,DONDAT0034
CTMON00327,MENU000457,9,Performance agent represent social.,0,DONDAT2209
CTMON00328,MENU000169,9,Development surface local class book hotel thought official.,0,DONDAT1762
CTMON00329,MENU000441,5,Our discover listen third.,0,DONDAT1990
CTMON00330,MENU000365,2,My oil actually.,0,DONDAT0581
CTMON00331,MENU000154,6,Summer participant Mrs environmental cup ok.,0,DONDAT2021
CTMON00332,MENU000222,4,Measure actually name stuff economy between.,0,DONDAT2796
CTMON00333,MENU000162,9,Politics career door music.,0,DONDAT0883
CTMON00334,MENU000107,1,This certain nation man around factor.,0,DONDAT1505
CTMON00335,MENU000270,8,Task likely join up system.,0,DONDAT2774
CTMON00336,MENU000350,9,Movement member speak choose sound candidate.,0,DONDAT1947
CTMON00337,MENU000094,1,Fine edge effect do financial reason member least.,0,DONDAT2826
CTMON00338,MENU000318,6,Group pick between as age.,0,DONDAT2233
CTMON00339,MENU000374,2,None before experience amount radio hotel.,0,DONDAT0225
CTMON00340,MENU000557,2,Way real table create prove usually main.,0,DONDAT0328
CTMON00341,MENU000268,4,Per book design indeed including left recent.,0,DONDAT1880
CTMON00342,MENU000478,5,Scientist life yeah film effect network.,0,DONDAT0227
CTMON00343,MENU000354,8,Whatever kid sea.,0,DONDAT2700
CTMON00344,MENU000025,8,Deal activity new police wish plant car particular.,0,DONDAT1172
CTMON00345,MENU000212,10,Carry rich important yeah often important federal.,0,DONDAT0326
CTMON00346,MENU000214,3,Return charge upon off hospital.,0,DONDAT1075
CTMON00347,MENU000466,10,Anyone industry with safe.,0,DONDAT1978
CTMON00348,MENU000472,2,Position she share meet.,0,DONDAT0602
CTMON00349,MENU000161,6,Summer already choice wonder.,0,DONDAT2544
CTMON00350,MENU000221,4,Figure particularly pretty structure relate man.,0,DONDAT2026
