MACTMON,MAMENU,SOLUONG,GHICHU,DONGIATONG,MADONDATMON
CTMON02799,MENU000530,3,Reflect see surface tend work high such.,0,DONDAT2189
CTMON02800,MENU000224,4,The lawyer bed miss allow program.,0,DONDAT1001
CTMON02801,MENU000296,6,Meet might reason artist deep plan.,0,DONDAT0006
CTMON02802,MENU000542,3,Foot enough reality.,0,DONDAT1416
CTMON02803,MENU000519,6,Effect option none quickly strategy sound.,0,DONDAT1095
CTMON02804,MENU000490,9,Draw space parent dinner.,0,DONDAT0831
CTMON02805,MENU000339,10,Down cover hot value industry.,0,DONDAT0949
CTMON02806,MENU000323,5,Seem bar support market mind.,0,DONDAT1391
CTMON02807,MENU000534,8,If relationship enter hand.,0,DONDAT1316
CTMON02808,MENU000151,6,Day pressure skin piece practice old everyone.,0,DONDAT0721
CTMON02809,MENU000172,2,Despite easy establish against for.,0,DONDAT2306
CTMON02810,MENU000333,8,Describe significant involve.,0,DONDAT1834
CTMON02811,MENU000228,4,Morning expect sell series right read stuff.,0,DONDAT0143
CTMON02812,MENU000333,2,Task benefit weight mouth common compare loss.,0,DONDAT1468
CTMON02813,MENU000529,1,Style vote traditional each daughter he ready.,0,DONDAT0797
CTMON02814,MENU000247,8,Everyone method huge identify a live feel.,0,DONDAT1029
CTMON02815,MENU000249,1,East simply peace teach those.,0,DONDAT0319
CTMON02816,MENU000398,6,End similar event democratic.,0,DONDAT0652
CTMON02817,MENU000111,10,Style training play production hair meeting newspaper.,0,DONDAT2942
CTMON02818,MENU000476,5,Of particularly purpose month administration according assume.,0,DONDAT1575
CTMON02819,MENU000534,8,Year mind brother economic we body system.,0,DONDAT2418
CTMON02820,MENU000579,8,Interview trip discover.,0,DONDAT1471
CTMON02821,MENU000409,10,Land apply shake consumer technology.,0,DONDAT1003
CTMON02822,MENU000195,3,Professional subject modern become special nice sing.,0,DONDAT2327
CTMON02823,MENU000450,3,Bring find teach relationship degree building about.,0,DONDAT2496
CTMON02824,MENU000171,1,Hit simply sit.,0,DONDAT2464
CTMON02825,MENU000427,5,Determine Mr politics north argue.,0,DONDAT2293
CTMON02826,MENU000478,9,Whose modern lay answer heart.,0,DONDAT2055
CTMON02827,MENU000372,3,Decision radio television always threat box.,0,DONDAT0091
CTMON02828,MENU000174,7,Happy ten there five series population.,0,DONDAT0305
CTMON02829,MENU000591,2,Wait population cultural cup according whether whose meeting.,0,DONDAT1308
CTMON02830,MENU000293,2,Would choose most adult key consider hospital.,0,DONDAT2148
CTMON02831,MENU000591,7,Show after forget week form rest.,0,DONDAT0111
CTMON02832,MENU000162,2,Usually painting brother Congress seem them ever song.,0,DONDAT2690
CTMON02833,MENU000152,3,City strong investment.,0,DONDAT2967
CTMON02834,MENU000096,5,Teacher positive safe body item.,0,DONDAT1498
CTMON02835,MENU000533,2,Agreement buy near director next table our cell.,0,DONDAT0010
CTMON02836,MENU000356,3,Career letter ground there approach quality anyone.,0,DONDAT2377
CTMON02837,MENU000566,2,Know box industry mother be soldier.,0,DONDAT0399
CTMON02838,MENU000506,2,Sea language impact century mother.,0,DONDAT2714
CTMON02839,MENU000279,1,Special able open.,0,DONDAT0307
CTMON02840,MENU000209,2,After yard station career thought world decide.,0,DONDAT1308
CTMON02841,MENU000137,7,Machine stand surface third significant a in.,0,DONDAT0384
CTMON02842,MENU000160,1,Especially perhaps clearly power.,0,DONDAT2619
CTMON02843,MENU000017,9,Letter nature that local right son outside.,0,DONDAT1235
CTMON02844,MENU000182,7,Worry quickly walk result drop ok.,0,DONDAT2031
CTMON02845,MENU000450,1,Customer policy street.,0,DONDAT1047
CTMON02846,MENU000388,6,Lawyer purpose cut sure likely show thus.,0,DONDAT1848
CTMON02847,MENU000168,1,Majority dog learn paper.,0,DONDAT0229
CTMON02848,MENU000081,6,Everybody treat change front.,0,DONDAT1030
CTMON02849,MENU000365,5,When situation police personal mother process bar.,0,DONDAT0083
CTMON02850,MENU000134,5,Response need center especially necessary per best.,0,DONDAT2096
CTMON02851,MENU000005,9,Buy white interesting over stand.,0,DONDAT0793
CTMON02852,MENU000088,8,Image community care team sure address form.,0,DONDAT1892
CTMON02853,MENU000065,3,Board sea ten modern.,0,DONDAT1880
CTMON02854,MENU000163,3,Growth agree together use.,0,DONDAT1269
CTMON02855,MENU000398,4,Bill decision prove market policy state.,0,DONDAT2460
CTMON02856,MENU000193,4,Live become accept position itself campaign.,0,DONDAT0316
CTMON02857,MENU000536,9,Most other draw reason ready.,0,DONDAT1857
CTMON02858,MENU000593,4,Onto democratic buy last it ball customer.,0,DONDAT0482
CTMON02859,MENU000138,8,Space impact value per.,0,DONDAT1704
CTMON02860,MENU000314,8,Short whole themselves least ability more step democratic.,0,DONDAT1456
CTMON02861,MENU000473,1,Health single next again billion.,0,DONDAT0632
CTMON02862,MENU000014,5,Training occur rate future certainly stuff subject.,0,DONDAT2524
CTMON02863,MENU000132,8,Magazine bring should shoulder once.,0,DONDAT1306
CTMON02864,MENU000516,3,Surface recognize skin.,0,DONDAT1799
CTMON02865,MENU000570,6,Woman hit among certainly resource stage hotel program.,0,DONDAT1262
CTMON02866,MENU000154,10,Where pay large enough ground now.,0,DONDAT0217
CTMON02867,MENU000093,2,Series resource production sometimes.,0,DONDAT1530
CTMON02868,MENU000013,8,Reflect choice eye child today miss nation.,0,DONDAT1522
CTMON02869,MENU000469,5,Between often face candidate win a.,0,DONDAT0659
CTMON02870,MENU000160,4,Likely bar party.,0,DONDAT1498
CTMON02871,MENU000285,5,Minute fine sort worry.,0,DONDAT1214
CTMON02872,MENU000524,8,West then get resource walk.,0,DONDAT2422
CTMON02873,MENU000291,10,Teach minute professional pick dinner space.,0,DONDAT0374
CTMON02874,MENU000393,3,Them health teacher fast again crime.,0,DONDAT0329
CTMON02875,MENU000371,7,Just boy speak democratic.,0,DONDAT2308
CTMON02876,MENU000530,9,Process letter rule.,0,DONDAT0190
CTMON02877,MENU000320,8,Future write officer network nature family above.,0,DONDAT0389
CTMON02878,MENU000298,2,Decision fire truth.,0,DONDAT1313
CTMON02879,MENU000511,4,Call hour exist someone.,0,DONDAT2992
CTMON02880,MENU000149,3,Order reveal study loss phone short bit.,0,DONDAT2741
CTMON02881,MENU000223,4,Mean together nearly too low group.,0,DONDAT0801
CTMON02882,MENU000179,9,How hot TV dinner itself throw.,0,DONDAT2318
CTMON02883,MENU000429,10,Citizen kind pattern hundred over computer.,0,DONDAT2074
CTMON02884,MENU000052,7,Recently third attention.,0,DONDAT2875
CTMON02885,MENU000314,8,Score instead above analysis.,0,DONDAT2747
CTMON02886,MENU000140,1,Fill bar traditional step challenge.,0,DONDAT1297
CTMON02887,MENU000236,1,Pass entire air friend challenge price effort.,0,DONDAT2472
CTMON02888,MENU000548,5,Song still security will expert home.,0,DONDAT2664
CTMON02889,MENU000446,2,Ability prove condition per.,0,DONDAT2550
CTMON02890,MENU000220,5,After hospital reason low.,0,DONDAT2107
CTMON02891,MENU000005,4,Necessary sure cost over.,0,DONDAT0343
CTMON02892,MENU000255,7,Degree figure fear executive amount.,0,DONDAT2616
CTMON02893,MENU000391,5,Event leave write live west must more benefit.,0,DONDAT0629
CTMON02894,MENU000159,6,Relationship concern may environment minute behind site.,0,DONDAT2888
CTMON02895,MENU000138,4,Market dog election science threat they.,0,DONDAT2039
CTMON02896,MENU000259,10,Difficult page huge create can spring size right.,0,DONDAT0789
CTMON02897,MENU000273,9,Amount age happen position method pick stand.,0,DONDAT0284
CTMON02898,MENU000540,8,Why tell tonight produce speech.,0,DONDAT1260
CTMON02899,MENU000208,3,Area subject relate night.,0,DONDAT2383
CTMON02900,MENU000452,7,Our cultural actually model region community card.,0,DONDAT0439
CTMON02901,MENU000020,8,Prepare level discuss lead.,0,DONDAT2223
CTMON02902,MENU000024,7,Model particular pick.,0,DONDAT0862
CTMON02903,MENU000184,7,Truth forward turn very.,0,DONDAT1621
CTMON02904,MENU000260,10,Ever true who case important successful.,0,DONDAT1744
CTMON02905,MENU000196,5,Program about body investment project.,0,DONDAT2814
CTMON02906,MENU000253,7,Age huge cause land series.,0,DONDAT0875
CTMON02907,MENU000392,7,Shoulder whose system.,0,DONDAT1739
CTMON02908,MENU000401,9,Similar enjoy safe check candidate before.,0,DONDAT2979
CTMON02909,MENU000392,9,Share early who medical.,0,DONDAT1849
CTMON02910,MENU000565,8,Across population always economic protect defense seat.,0,DONDAT1716
CTMON02911,MENU000530,8,Hand season ready both may north.,0,DONDAT2984
CTMON02912,MENU000177,8,Become they point consider continue.,0,DONDAT0260
CTMON02913,MENU000574,2,Line bad our miss.,0,DONDAT2434
CTMON02914,MENU000248,9,Down left computer claim president for reach.,0,DONDAT1737
CTMON02915,MENU000301,5,See no add before loss age choice.,0,DONDAT1893
CTMON02916,MENU000135,6,Option myself let season have.,0,DONDAT1554
CTMON02917,MENU000217,2,Accept third thing science less yourself.,0,DONDAT1054
CTMON02918,MENU000470,4,Similar bill toward gas such must.,0,DONDAT0621
CTMON02919,MENU000030,10,Movement poor energy real he worker.,0,DONDAT2637
CTMON02920,MENU000418,9,Natural which system couple thus short almost.,0,DONDAT0217
CTMON02921,MENU000145,10,Lawyer each religious week three officer.,0,DONDAT0184
CTMON02922,MENU000291,2,Religious look American town increase.,0,DONDAT1885
CTMON02923,MENU000536,6,We history for great describe.,0,DONDAT1056
CTMON02924,MENU000417,1,Eye fall condition since federal success.,0,DONDAT1972
CTMON02925,MENU000343,10,Behavior animal usually church.,0,DONDAT1795
CTMON02926,MENU000142,1,Find bag each.,0,DONDAT2234
CTMON02927,MENU000037,6,Represent work enough although up skin her form.,0,DONDAT0090
CTMON02928,MENU000372,4,Particularly hope agent though eat.,0,DONDAT2750
CTMON02929,MENU000137,5,Rise without spring student idea rich government.,0,DONDAT2724
CTMON02930,MENU000282,5,Realize everybody become here hold leg democratic.,0,DONDAT2151
CTMON02931,MENU000096,4,Image early voice trial always off.,0,DONDAT1067
CTMON02932,MENU000043,5,Wall last necessary class gun important most hotel.,0,DONDAT2746
CTMON02933,MENU000586,7,Cost boy new bag body.,0,DONDAT1653
CTMON02934,MENU000039,4,Call pay care real need also where.,0,DONDAT0664
CTMON02935,MENU000319,3,South question politics thus explain apply technology.,0,DONDAT1526
CTMON02936,MENU000386,7,War cause least after tree great mention.,0,DONDAT0839
CTMON02937,MENU000072,7,Clear finish west hope buy month.,0,DONDAT2281
CTMON02938,MENU000382,7,Loss yourself feel do.,0,DONDAT2242
CTMON02939,MENU000436,1,Good after radio girl.,0,DONDAT2448
CTMON02940,MENU000035,5,Some fish impact candidate I beyond.,0,DONDAT1037
CTMON02941,MENU000590,3,Senior unit alone national stage record.,0,DONDAT2015
CTMON02942,MENU000350,4,These product to modern especially.,0,DONDAT2810
CTMON02943,MENU000513,9,Tend water off soon away west free trip.,0,DONDAT1708
CTMON02944,MENU000187,9,Available anyone act authority.,0,DONDAT0928
CTMON02945,MENU000386,6,Her population our part.,0,DONDAT2604
CTMON02946,MENU000415,10,Conference consider garden forward performance light affect.,0,DONDAT0821
CTMON02947,MENU000388,6,When might concern.,0,DONDAT2502
CTMON02948,MENU000078,2,Card cold help man have officer subject.,0,DONDAT0547
CTMON02949,MENU000011,1,Personal during similar support manage.,0,DONDAT0410
CTMON02950,MENU000363,5,Decision nor again director artist rock party million.,0,DONDAT2555
CTMON02951,MENU000447,7,Reduce station smile product.,0,DONDAT2659
CTMON02952,MENU000264,9,Room increase hold your hundred account organization.,0,DONDAT0481
CTMON02953,MENU000011,9,Baby design sound forget wind yard.,0,DONDAT1284
CTMON02954,MENU000096,10,Focus three information wish adult eight.,0,DONDAT1848
CTMON02955,MENU000120,9,Whose its style sell major energy general stand.,0,DONDAT0059
CTMON02956,MENU000125,2,End population certainly director.,0,DONDAT2083
CTMON02957,MENU000409,2,Health approach teacher hope more over I.,0,DONDAT1908
CTMON02958,MENU000131,4,Almost recognize so hundred fight simple.,0,DONDAT0471
CTMON02959,MENU000551,3,Sense change past mouth model.,0,DONDAT2333
CTMON02960,MENU000270,3,Expect return water she however watch.,0,DONDAT2375
CTMON02961,MENU000003,1,Factor reduce many.,0,DONDAT1450
CTMON02962,MENU000122,6,Build into policy behavior break.,0,DONDAT0619
CTMON02963,MENU000329,9,Than piece according politics newspaper family.,0,DONDAT0975
CTMON02964,MENU000442,8,Early risk strong among interesting.,0,DONDAT1966
CTMON02965,MENU000349,4,Debate detail receive just strong herself.,0,DONDAT0581
CTMON02966,MENU000163,10,Pay worker with hand major sell.,0,DONDAT0430
CTMON02967,MENU000585,3,Probably begin song town.,0,DONDAT1556
CTMON02968,MENU000380,5,Career hope marriage nature me Democrat stay dinner.,0,DONDAT2674
CTMON02969,MENU000541,8,Prevent may court cold book.,0,DONDAT2506
CTMON02970,MENU000191,10,Speak kid near sound politics question degree.,0,DONDAT2706
CTMON02971,MENU000449,1,Able out suffer size benefit.,0,DONDAT0171
CTMON02972,MENU000413,9,Grow also however level help garden.,0,DONDAT0063
CTMON02973,MENU000275,5,Do represent TV part down rest.,0,DONDAT2797
CTMON02974,MENU000342,1,Entire eye join model capital.,0,DONDAT2854
CTMON02975,MENU000288,8,Yard off him price animal.,0,DONDAT1980
CTMON02976,MENU000140,3,Energy song every because course.,0,DONDAT0812
CTMON02977,MENU000001,5,Trouble candidate television kind.,0,DONDAT1017
CTMON02978,MENU000052,7,Above main form thought same.,0,DONDAT2818
CTMON02979,MENU000084,1,Herself couple west less south.,0,DONDAT0187
CTMON02980,MENU000101,4,Fine case since.,0,DONDAT0432
CTMON02981,MENU000029,3,Guy shoulder same item onto important.,0,DONDAT0381
CTMON02982,MENU000199,2,Stage machine drug when order big news.,0,DONDAT0804
CTMON02983,MENU000235,5,Happen another test begin show just pressure.,0,DONDAT2900
CTMON02984,MENU000258,7,Yet any sound director option true.,0,DONDAT2607
CTMON02985,MENU000060,4,Your some to keep ball medical focus.,0,DONDAT1841
CTMON02986,MENU000043,5,Head experience story manage.,0,DONDAT2466
CTMON02987,MENU000425,7,Sign office present tonight whose.,0,DONDAT2409
CTMON02988,MENU000234,9,Among family sister smile.,0,DONDAT1329
CTMON02989,MENU000514,6,Different bed fall foreign week fear.,0,DONDAT2164
CTMON02990,MENU000049,1,Little game expert child material every generation.,0,DONDAT1074
CTMON02991,MENU000471,10,Ball at professional send positive provide.,0,DONDAT1088
CTMON02992,MENU000535,6,Lose deep source newspaper.,0,DONDAT2489
CTMON02993,MENU000512,5,Student better heavy everybody such Democrat.,0,DONDAT0121
CTMON02994,MENU000546,4,Able today red prepare think city from.,0,DONDAT2268
CTMON02995,MENU000108,5,Maintain truth Mr call seat evening.,0,DONDAT2289
CTMON02996,MENU000032,5,Explain mouth expect challenge own.,0,DONDAT0174
CTMON02997,MENU000116,10,East blood begin between language.,0,DONDAT0941
CTMON02998,MENU000490,3,Beyond realize spring woman believe guy.,0,DONDAT1872
CTMON02999,MENU000068,8,When rise into feel situation country.,0,DONDAT2265
CTMON03000,MENU000225,3,Much official fight run sister.,0,DONDAT2627
CTMON03001,MENU000116,1,Full effect behavior easy know charge offer.,0,DONDAT2316
CTMON03002,MENU000453,10,Though husband off single.,0,DONDAT0622
CTMON03003,MENU000197,9,Six bill staff speak quality happy.,0,DONDAT2194
CTMON03004,MENU000565,7,Population government natural indeed city attorney property.,0,DONDAT1392
CTMON03005,MENU000294,5,Church life open hot realize.,0,DONDAT0486
CTMON03006,MENU000250,7,Lose window economic wear tonight culture remain.,0,DONDAT1426
CTMON03007,MENU000349,8,People as chair real relate score.,0,DONDAT2767
CTMON03008,MENU000319,9,Successful practice significant four customer decide before.,0,DONDAT0954
CTMON03009,MENU000429,7,Body good scientist wear president above.,0,DONDAT0052
CTMON03010,MENU000239,7,Attack play board attorney charge build.,0,DONDAT1148
CTMON03011,MENU000324,8,Director look themselves future matter recently worry take.,0,DONDAT2286
CTMON03012,MENU000020,2,Where type to trouble buy wish.,0,DONDAT1691
CTMON03013,MENU000075,2,Traditional father stand change around interesting.,0,DONDAT2033
CTMON03014,MENU000163,4,Teacher subject something action.,0,DONDAT2226
CTMON03015,MENU000540,3,Sing sister team include ground.,0,DONDAT1366
CTMON03016,MENU000185,7,Organization off scientist.,0,DONDAT2315
CTMON03017,MENU000016,3,Some would rock or full worker could.,0,DONDAT1624
CTMON03018,MENU000044,5,Future remember lawyer authority international.,0,DONDAT0672
CTMON03019,MENU000010,7,Everything why information television decade.,0,DONDAT0991
CTMON03020,MENU000537,5,Structure throughout various wish whose religious suggest.,0,DONDAT1469
CTMON03021,MENU000235,10,Tax very physical too letter.,0,DONDAT2586
CTMON03022,MENU000444,3,Fly heart official.,0,DONDAT2866
CTMON03023,MENU000201,2,Pull country person past which little buy play.,0,DONDAT1347
CTMON03024,MENU000272,8,Wind mother bring never energy.,0,DONDAT2570
CTMON03025,MENU000276,7,Group or must write back reveal light.,0,DONDAT2245
CTMON03026,MENU000600,2,Follow approach scientist as admit.,0,DONDAT1198
CTMON03027,MENU000425,9,Seven rest along animal east.,0,DONDAT2271
CTMON03028,MENU000190,4,Loss agreement forward seek.,0,DONDAT2619
CTMON03029,MENU000300,10,Star down begin right benefit.,0,DONDAT1475
CTMON03030,MENU000024,9,Way discussion military girl over cup already.,0,DONDAT1369
CTMON03031,MENU000599,4,If dinner adult reason security manage agreement carry.,0,DONDAT1552
CTMON03032,MENU000514,8,Check raise environment yourself first rule couple.,0,DONDAT0980
CTMON03033,MENU000293,7,Need too market none.,0,DONDAT0198
CTMON03034,MENU000128,3,Rock movie significant heart those foreign forward.,0,DONDAT0657
CTMON03035,MENU000050,9,Sport project debate experience discover forget door.,0,DONDAT2745
CTMON03036,MENU000308,8,Although mother right soldier article particularly their.,0,DONDAT1258
CTMON03037,MENU000206,10,Whatever culture rise military really effort least when.,0,DONDAT2319
CTMON03038,MENU000597,7,Article just lot appear.,0,DONDAT1610
CTMON03039,MENU000508,10,Law young feel treat attack.,0,DONDAT1890
CTMON03040,MENU000567,7,Doctor budget study fast senior treat school.,0,DONDAT0660
CTMON03041,MENU000318,1,Policy small visit fire society must.,0,DONDAT1418
CTMON03042,MENU000439,7,Place able teach language.,0,DONDAT2909
CTMON03043,MENU000012,10,Local could until usually.,0,DONDAT2763
CTMON03044,MENU000268,4,Bit work research own civil arm.,0,DONDAT1018
CTMON03045,MENU000092,1,Model meeting crime hair blood west.,0,DONDAT0046
CTMON03046,MENU000505,3,Join not authority yet them only off marriage.,0,DONDAT2209
CTMON03047,MENU000064,7,Move of figure exactly six old movie.,0,DONDAT1561
CTMON03048,MENU000410,2,Official source card include spend.,0,DONDAT0473
CTMON03049,MENU000049,2,Within color stand table front.,0,DONDAT2885
CTMON03050,MENU000475,6,Feeling three owner camera could fast.,0,DONDAT1439
CTMON03051,MENU000149,6,Late send line never often.,0,DONDAT2322
CTMON03052,MENU000224,2,Ready whole gas material begin wall local.,0,DONDAT2619
CTMON03053,MENU000007,1,Charge chair any race list face decade.,0,DONDAT2673
CTMON03054,MENU000493,5,Writer recently next discuss street finally remember.,0,DONDAT0488
CTMON03055,MENU000321,5,Up argue want others against.,0,DONDAT1663
CTMON03056,MENU000502,4,Area respond after film.,0,DONDAT0586
CTMON03057,MENU000438,2,Protect girl happen treat out beat win society.,0,DONDAT2141
CTMON03058,MENU000527,5,Full car art perform local free laugh.,0,DONDAT0085
CTMON03059,MENU000530,5,Job try hundred cut off.,0,DONDAT1356
CTMON03060,MENU000054,6,Huge treat station operation.,0,DONDAT2828
CTMON03061,MENU000041,4,Part image deal society leg various standard.,0,DONDAT1348
CTMON03062,MENU000591,10,Here agent challenge live baby.,0,DONDAT1832
CTMON03063,MENU000454,2,Stage key land stock.,0,DONDAT0364
CTMON03064,MENU000150,9,Talk kind event hear travel stuff piece.,0,DONDAT0781
CTMON03065,MENU000055,9,Event according factor money expect control.,0,DONDAT1236
CTMON03066,MENU000099,7,Vote model big act responsibility team.,0,DONDAT0663
CTMON03067,MENU000096,10,Official scientist moment determine fire start part.,0,DONDAT2671
CTMON03068,MENU000191,4,Play draw author need billion.,0,DONDAT1037
CTMON03069,MENU000249,8,Chance benefit say source.,0,DONDAT0734
CTMON03070,MENU000416,10,Term sure their worker.,0,DONDAT0158
CTMON03071,MENU000443,1,Have television prepare tree world.,0,DONDAT1781
CTMON03072,MENU000524,7,Really international wall down similar evening personal top.,0,DONDAT2886
CTMON03073,MENU000551,8,Apply work chair near particularly individual.,0,DONDAT0955
CTMON03074,MENU000129,3,Politics worker feeling ready series total huge.,0,DONDAT0781
CTMON03075,MENU000192,2,Office century western product maintain candidate.,0,DONDAT1662
CTMON03076,MENU000094,1,Each set what up.,0,DONDAT2193
CTMON03077,MENU000397,1,Thousand interest section.,0,DONDAT0458
CTMON03078,MENU000217,4,Position bag well position tough discover interview.,0,DONDAT1985
CTMON03079,MENU000073,10,Let success method soon like manage.,0,DONDAT0678
CTMON03080,MENU000344,5,Fire least kitchen true.,0,DONDAT1975
CTMON03081,MENU000419,3,Reach turn health write hit.,0,DONDAT1594
CTMON03082,MENU000276,4,Everything true yes since.,0,DONDAT0756
CTMON03083,MENU000354,1,Budget option whatever nation clearly single maintain network.,0,DONDAT0733
CTMON03084,MENU000051,5,Mrs light rock story.,0,DONDAT0418
CTMON03085,MENU000278,5,Safe old million partner add lose.,0,DONDAT2995
CTMON03086,MENU000392,9,Loss agreement time vote may fast.,0,DONDAT2005
CTMON03087,MENU000273,8,Right debate prevent north risk here.,0,DONDAT0269
CTMON03088,MENU000127,1,Rule off middle capital result maybe.,0,DONDAT2357
CTMON03089,MENU000083,2,Paper fall national head collection during.,0,DONDAT2500
CTMON03090,MENU000515,10,Follow over sometimes include skill.,0,DONDAT1058
CTMON03091,MENU000515,7,Total institution all base.,0,DONDAT2274
CTMON03092,MENU000068,5,Think treatment much might seat sound machine.,0,DONDAT2103
CTMON03093,MENU000045,1,Thought represent support last glass million.,0,DONDAT1550
CTMON03094,MENU000220,3,Writer back interest radio drive.,0,DONDAT0538
CTMON03095,MENU000208,1,Forget hundred clear firm reduce under.,0,DONDAT1644
CTMON03096,MENU000169,4,Floor source forward military.,0,DONDAT2122
CTMON03097,MENU000020,9,Good often despite play stop.,0,DONDAT1752
CTMON03098,MENU000013,1,Vote but finally each during technology.,0,DONDAT0504
CTMON03099,MENU000331,9,Realize base meeting east quite west customer report.,0,DONDAT1038
CTMON03100,MENU000301,1,Bank reach consider article practice rise region.,0,DONDAT2239
CTMON03101,MENU000308,1,Recently often society administration response.,0,DONDAT2559
CTMON03102,MENU000395,1,Although student anyone director wife security.,0,DONDAT0105
CTMON03103,MENU000565,4,Camera chance day friend check research performance.,0,DONDAT0684
CTMON03104,MENU000447,6,Role floor law affect official he toward father.,0,DONDAT2658
CTMON03105,MENU000437,7,Moment only physical either focus general system.,0,DONDAT0943
CTMON03106,MENU000535,9,Democrat sit dinner necessary big.,0,DONDAT0334
CTMON03107,MENU000231,7,Appear present exactly street name our.,0,DONDAT2151
CTMON03108,MENU000459,2,Allow think gas rather rise as plant.,0,DONDAT0739
CTMON03109,MENU000531,2,Left law plant receive stuff sing section foot.,0,DONDAT0192
CTMON03110,MENU000363,7,Account be keep court general.,0,DONDAT0502
CTMON03111,MENU000487,6,Kind reduce body student issue process.,0,DONDAT0555
CTMON03112,MENU000097,2,Expect prevent manager role choose north.,0,DONDAT1790
CTMON03113,MENU000586,3,According analysis ground eye.,0,DONDAT1289
CTMON03114,MENU000019,5,Help reduce how with.,0,DONDAT2913
CTMON03115,MENU000283,6,Stock floor gun good southern.,0,DONDAT2280
CTMON03116,MENU000418,3,Point support role upon.,0,DONDAT1406
CTMON03117,MENU000057,10,Picture country speak remember.,0,DONDAT2777
CTMON03118,MENU000334,4,Significant left person your coach offer find.,0,DONDAT1190
CTMON03119,MENU000517,10,Because remain stock arm.,0,DONDAT2962
CTMON03120,MENU000009,1,Threat lead side until.,0,DONDAT0361
CTMON03121,MENU000391,6,Truth white offer campaign American can next.,0,DONDAT0445
CTMON03122,MENU000030,8,Enough money provide third discuss type compare doctor.,0,DONDAT1207
CTMON03123,MENU000146,5,Control western food human.,0,DONDAT2926
CTMON03124,MENU000053,9,Candidate poor describe medical run discuss sense.,0,DONDAT2622
CTMON03125,MENU000037,5,Significant glass sport often.,0,DONDAT0055
CTMON03126,MENU000036,6,Another century down size.,0,DONDAT1646
CTMON03127,MENU000209,6,Describe edge agency statement future national few.,0,DONDAT2505
CTMON03128,MENU000273,2,Town determine employee or your film.,0,DONDAT2596
CTMON03129,MENU000582,7,Allow indeed sort water stand of.,0,DONDAT1199
CTMON03130,MENU000265,8,Bag town situation final international behavior eight occur.,0,DONDAT0782
CTMON03131,MENU000560,6,Consumer task large person he others.,0,DONDAT2756
CTMON03132,MENU000168,7,Certainly bad news remember sit member.,0,DONDAT0305
CTMON03133,MENU000581,2,Project miss look operation assume.,0,DONDAT0139
CTMON03134,MENU000096,2,That system movement visit citizen account.,0,DONDAT0216
CTMON03135,MENU000350,6,Space yet story relationship standard hold.,0,DONDAT2376
CTMON03136,MENU000049,3,Thousand suddenly require where action once become.,0,DONDAT2662
CTMON03137,MENU000256,7,Oil different next hundred sure.,0,DONDAT1997
CTMON03138,MENU000550,2,Building money own.,0,DONDAT1782
CTMON03139,MENU000495,2,Raise different across training should.,0,DONDAT2256
CTMON03140,MENU000331,3,Start ahead various work rich buy.,0,DONDAT0557
CTMON03141,MENU000425,9,Major interview listen special class attack.,0,DONDAT1749
CTMON03142,MENU000516,3,Life bring future others.,0,DONDAT1009
CTMON03143,MENU000530,3,Do body little officer night.,0,DONDAT1654
